-- Course Offerings Import
-- Generated: 2025-11-18T16:28:38.427342
-- Source: C:\Users\alex\MTL_App\specs\001-title-english-language\imports\out\courses_normalized.json

INSERT INTO course_offerings (
    attendance_id, round, course_key, course_full_name, level, program, type,
    start_date, end_date, hours_total, schedule, price, location, online,
    course_book, created_at, updated_at
) VALUES (
    'B1_EVE _EDMON_1', 1, 'B1_EVE _EDMON_1', 'B1 EVE ONLINE - EDMONTON - 13.01.2025 - R1', 'B1', 'EDMONTON', 'EVE ONLINE',
    '2025-01-13', '2025-02-19', 24, '{"days": ["M", "W"], "time_range": "19:00-21:00"}', 385.0, 'ONLINE', 1,
    'English File Intermediate 4th Edition (ISBN-13978-0194035910)', NOW(), NOW()
);
INSERT INTO course_offerings (
    attendance_id, round, course_key, course_full_name, level, program, type,
    start_date, end_date, hours_total, schedule, price, location, online,
    course_book, created_at, updated_at
) VALUES (
    'B2_EVE _EDMON_1', 1, 'B2_EVE _EDMON_1', 'B2 EVE ONLINE - EDMONTON - 13.01.2025 - R1', 'B2', 'EDMONTON', 'EVE ONLINE',
    '2025-01-13', '2025-02-19', 24, '{"days": ["M", "W"], "time_range": "19:00-21:00"}', 385.0, 'ONLINE', 1,
    'English File Upper Intermediate 4th Edition (ISBN-978-0194039697)', NOW(), NOW()
);
INSERT INTO course_offerings (
    attendance_id, round, course_key, course_full_name, level, program, type,
    start_date, end_date, hours_total, schedule, price, location, online,
    course_book, created_at, updated_at
) VALUES (
    'A1_BEGI_DUBLI_1', 1, 'A1_BEGI_DUBLI_1', 'A1 BEGINNER - DUBLIN - 13.01.2025 - R1', 'A1', 'DUBLIN', 'BEGINNER',
    '2025-01-13', '2025-02-19', 24, '{"days": ["M", "W"], "time_range": "15:30-17:30"}', 445.0, 'MixTree Languages - Eerste Weteringplantsoen 2c - 1017 SJ Amsterdam', 0,
    'English File Beginner Student’s Book - 4th Edition (ISBN-13978-0194029803)', NOW(), NOW()
);
INSERT INTO course_offerings (
    attendance_id, round, course_key, course_full_name, level, program, type,
    start_date, end_date, hours_total, schedule, price, location, online,
    course_book, created_at, updated_at
) VALUES (
    'A2_INTE_BOSTO_1', 1, 'A2_INTE_BOSTO_1', 'A2 INTENSIVE - BOSTON - 13.01.2025 - R1', 'A2', 'BOSTON', 'INTENSIVE',
    '2025-01-13', '2025-02-07', 40, '{"days": ["M", "T", "Th", "F"], "time_range": "12:30-15:00"}', 640.0, 'MixTree Languages - Eerste Weteringplantsoen 2c - 1017 SJ Amsterdam', 0,
    'English File Pre-Intermediate 4th Edition (ISBN-13 978-0194037419)', NOW(), NOW()
);
INSERT INTO course_offerings (
    attendance_id, round, course_key, course_full_name, level, program, type,
    start_date, end_date, hours_total, schedule, price, location, online,
    course_book, created_at, updated_at
) VALUES (
    'A2 EL_MORN_EDMON_1', 1, 'A2 EL_MORN_EDMON_1', 'A2 ELEM MORNING - EDMONTON - 13.01.2025 - R1', 'A2 ELEM', 'EDMONTON', 'MORNING',
    '2025-01-13', '2025-02-19', 30, '{"days": ["M", "W"], "time_range": "9:30-12:00"}', 525.0, 'MixTree Languages - Eerste Weteringplantsoen 2c - 1017 SJ Amsterdam', 0,
    'English File Elementary 4th Edition (ISBN-13978-0194031592)', NOW(), NOW()
);
INSERT INTO course_offerings (
    attendance_id, round, course_key, course_full_name, level, program, type,
    start_date, end_date, hours_total, schedule, price, location, online,
    course_book, created_at, updated_at
) VALUES (
    'B1_INTE_BOSTO_1', 1, 'B1_INTE_BOSTO_1', 'B1 INTENSIVE - BOSTON - 13.01.2025 - R1', 'B1', 'BOSTON', 'INTENSIVE',
    '2025-01-13', '2025-02-07', 40, '{"days": ["M", "T", "Th", "F"], "time_range": "15:30-18:00"}', 640.0, 'MixTree Languages - Eerste Weteringplantsoen 2c - 1017 SJ Amsterdam', 0,
    'English File Intermediate 4th Edition (ISBN-13978-0194035910)', NOW(), NOW()
);
INSERT INTO course_offerings (
    attendance_id, round, course_key, course_full_name, level, program, type,
    start_date, end_date, hours_total, schedule, price, location, online,
    course_book, created_at, updated_at
) VALUES (
    'B2_MORN_EDMON_1', 1, 'B2_MORN_EDMON_1', 'B2 MORNING - EDMONTON - 13.01.2025 - R1', 'B2', 'EDMONTON', 'MORNING',
    '2025-01-13', '2025-02-20', 30, '{"days": ["M", "Th"], "time_range": "9:30-12:00"}', 525.0, 'MixTree Languages - Eerste Weteringplantsoen 2c - 1017 SJ Amsterdam', 0,
    'English File Upper Intermediate 4th Edition (ISBN-978-0194039697)', NOW(), NOW()
);
INSERT INTO course_offerings (
    attendance_id, round, course_key, course_full_name, level, program, type,
    start_date, end_date, hours_total, schedule, price, location, online,
    course_book, created_at, updated_at
) VALUES (
    'C1_EVE _EDMON_1', 1, 'C1_EVE _EDMON_1', 'C1 EVE ONLINE - EDMONTON - 14.01.2025 - R1', 'C1', 'EDMONTON', 'EVE ONLINE',
    '2025-01-14', '2025-02-20', 24, '{"days": ["T", "Th"], "time_range": "19:00-21:00"}', 385.0, 'ONLINE', 1,
    'English File 4th: Advanced (ISBN-13978-0194038355)', NOW(), NOW()
);
INSERT INTO course_offerings (
    attendance_id, round, course_key, course_full_name, level, program, type,
    start_date, end_date, hours_total, schedule, price, location, online,
    course_book, created_at, updated_at
) VALUES (
    'A2 PR_MORN_EDMON_1', 1, 'A2 PR_MORN_EDMON_1', 'A2 PRE-INT MORNING - EDMONTON - 14.01.2025 - R1', 'A2 PRE-INT', 'EDMONTON', 'MORNING',
    '2025-01-14', '2025-02-20', 30, '{"days": ["T", "Th"], "time_range": "9:30-12:00"}', 525.0, 'MixTree Languages - Eerste Weteringplantsoen 2c - 1017 SJ Amsterdam', 0,
    'English File Pre-Intermediate 4th Edition (ISBN-13 978-0194037419)', NOW(), NOW()
);
INSERT INTO course_offerings (
    attendance_id, round, course_key, course_full_name, level, program, type,
    start_date, end_date, hours_total, schedule, price, location, online,
    course_book, created_at, updated_at
) VALUES (
    'C1_MORN_EDMON_1', 1, 'C1_MORN_EDMON_1', 'C1 MORNING - EDMONTON - 14.01.2025 - R1', 'C1', 'EDMONTON', 'MORNING',
    '2025-01-14', '2025-02-21', 30, '{"days": ["T", "F"], "time_range": "9:30-12:00"}', 525.0, 'MixTree Languages - Eerste Weteringplantsoen 2c - 1017 SJ Amsterdam', 0,
    'English File 4th: Advanced (ISBN-13978-0194038355)', NOW(), NOW()
);
INSERT INTO course_offerings (
    attendance_id, round, course_key, course_full_name, level, program, type,
    start_date, end_date, hours_total, schedule, price, location, online,
    course_book, created_at, updated_at
) VALUES (
    'B1_MORN_EDMON_1', 1, 'B1_MORN_EDMON_1', 'B1 MORNING - EDMONTON - 15.01.2025 - R1', 'B1', 'EDMONTON', 'MORNING',
    '2025-01-15', '2025-02-21', 30, '{"days": ["W", "F"], "time_range": "9:30-12:00"}', 525.0, 'MixTree Languages - Eerste Weteringplantsoen 2c - 1017 SJ Amsterdam', 0,
    'English File Intermediate 4th Edition (ISBN-13978-0194035910)', NOW(), NOW()
);
INSERT INTO course_offerings (
    attendance_id, round, course_key, course_full_name, level, program, type,
    start_date, end_date, hours_total, schedule, price, location, online,
    course_book, created_at, updated_at
) VALUES (
    'A2 PR_EVE _EDMON_1', 1, 'A2 PR_EVE _EDMON_1', 'A2 PRE-INT EVE ONLINE - EDMONTON - 28.01.2025 - R1', 'A2 PRE-INT', 'EDMONTON', 'EVE ONLINE',
    '2025-01-28', '2025-03-06', 18, '{"days": ["T", "F"], "time_range": "19:00-20:30"}', 385.0, 'ONLINE', 1,
    'English File Pre-Intermediate 4th Edition (ISBN-13 978-0194037419)', NOW(), NOW()
);
INSERT INTO course_offerings (
    attendance_id, round, course_key, course_full_name, level, program, type,
    start_date, end_date, hours_total, schedule, price, location, online,
    course_book, created_at, updated_at
) VALUES (
    'BUSIN_EVE _EDMON_1', 1, 'BUSIN_EVE _EDMON_1', 'BUSINESS EVE ONLINE - EDMONTON - 28.01.2025 - R1', 'BUSINESS', 'EDMONTON', 'EVE ONLINE',
    '2025-01-28', '2025-03-06', 24, '{"days": ["T", "F"], "time_range": "19.00-21.00"}', 385.0, 'ONLINE', 1,
    'Business Partner B2+ – Pearson Benelux', NOW(), NOW()
);
INSERT INTO course_offerings (
    attendance_id, round, course_key, course_full_name, level, program, type,
    start_date, end_date, hours_total, schedule, price, location, online,
    course_book, created_at, updated_at
) VALUES (
    'A2_INTE_CAPE _2', 2, 'A2_INTE_CAPE _2', 'A2 INTENSIVE - CAPE TOWN - 10.02.2025 - R2', 'A2', 'CAPE TOWN', 'INTENSIVE',
    '2025-02-10', '2025-03-07', 40, '{"days": ["M", "T", "Th", "F"], "time_range": "9:30-12:00"}', 640.0, 'MixTree Languages - Eerste Weteringplantsoen 2c - 1017 SJ Amsterdam', 0,
    'English File Pre-Intermediate 4th Edition (ISBN-13 978-0194037419)', NOW(), NOW()
);
INSERT INTO course_offerings (
    attendance_id, round, course_key, course_full_name, level, program, type,
    start_date, end_date, hours_total, schedule, price, location, online,
    course_book, created_at, updated_at
) VALUES (
    'B1_INTE_CAPE _2', 2, 'B1_INTE_CAPE _2', 'B1 INTENSIVE - CAPE TOWN - 10.02.2025 - R2', 'B1', 'CAPE TOWN', 'INTENSIVE',
    '2025-02-10', '2025-03-07', 40, '{"days": ["M", "T", "Th", "F"], "time_range": "12:30-15:00"}', 640.0, 'MixTree Languages - Eerste Weteringplantsoen 2c - 1017 SJ Amsterdam', 0,
    'English File Intermediate 4th Edition (ISBN-13978-0194035910)', NOW(), NOW()
);
INSERT INTO course_offerings (
    attendance_id, round, course_key, course_full_name, level, program, type,
    start_date, end_date, hours_total, schedule, price, location, online,
    course_book, created_at, updated_at
) VALUES (
    'B2_INTE_CAPE _2', 2, 'B2_INTE_CAPE _2', 'B2 INTENSIVE - CAPE TOWN - 10.02.2025 - R2', 'B2', 'CAPE TOWN', 'INTENSIVE',
    '2025-02-10', '2025-03-07', 40, '{"days": ["M", "T", "Th", "F"], "time_range": "15:30-18:00"}', 640.0, 'MixTree Languages - Eerste Weteringplantsoen 2c - 1017 SJ Amsterdam', 0,
    'English File Upper Intermediate 4th Edition (ISBN-978-0194039697)', NOW(), NOW()
);
INSERT INTO course_offerings (
    attendance_id, round, course_key, course_full_name, level, program, type,
    start_date, end_date, hours_total, schedule, price, location, online,
    course_book, created_at, updated_at
) VALUES (
    'B1_EVE _FIFE_2', 2, 'B1_EVE _FIFE_2', 'B1 EVE ONLINE - FIFE - 24.02.2025 - R2', 'B1', 'FIFE', 'EVE ONLINE',
    '2025-02-24', '2025-04-02', 24, '{"days": ["M", "W"], "time_range": "19:00-21:00"}', 385.0, 'ONLINE', 1,
    'English File Intermediate 4th Edition (ISBN-13978-0194035910)', NOW(), NOW()
);
INSERT INTO course_offerings (
    attendance_id, round, course_key, course_full_name, level, program, type,
    start_date, end_date, hours_total, schedule, price, location, online,
    course_book, created_at, updated_at
) VALUES (
    'B2_EVE _FIFE_2', 2, 'B2_EVE _FIFE_2', 'B2 EVE ONLINE - FIFE - 24.02.2025 - R2', 'B2', 'FIFE', 'EVE ONLINE',
    '2025-02-24', '2025-04-02', 24, '{"days": ["M", "W"], "time_range": "19:00-21:00"}', 385.0, 'ONLINE', 1,
    'English File Upper Intermediate 4th Edition (ISBN-978-0194039697)', NOW(), NOW()
);
INSERT INTO course_offerings (
    attendance_id, round, course_key, course_full_name, level, program, type,
    start_date, end_date, hours_total, schedule, price, location, online,
    course_book, created_at, updated_at
) VALUES (
    'A1_BEGI_EDMON_2', 2, 'A1_BEGI_EDMON_2', 'A1 BEGINNER - EDMONTON - 24.02.2025 - R2', 'A1', 'EDMONTON', 'BEGINNER',
    '2025-02-24', '2025-04-02', 24, '{"days": ["M", "W"], "time_range": "15:30-17:30"}', 445.0, 'MixTree Languages - Eerste Weteringplantsoen 2c - 1017 SJ Amsterdam', 0,
    'English File Beginner Student’s Book - 4th Edition (ISBN-13978-0194029803)', NOW(), NOW()
);
INSERT INTO course_offerings (
    attendance_id, round, course_key, course_full_name, level, program, type,
    start_date, end_date, hours_total, schedule, price, location, online,
    course_book, created_at, updated_at
) VALUES (
    'A2 EL_MORN_FIFE_2', 2, 'A2 EL_MORN_FIFE_2', 'A2 ELEM MORNING - FIFE - 24.02.2025 - R2', 'A2 ELEM', 'FIFE', 'MORNING',
    '2025-02-24', '2025-04-02', 30, '{"days": ["M", "W"], "time_range": "9:30-12:00"}', 525.0, 'MixTree Languages - Eerste Weteringplantsoen 2c - 1017 SJ Amsterdam', 0,
    'English File Elementary 4th Edition (ISBN-13978-0194031592)', NOW(), NOW()
);
INSERT INTO course_offerings (
    attendance_id, round, course_key, course_full_name, level, program, type,
    start_date, end_date, hours_total, schedule, price, location, online,
    course_book, created_at, updated_at
) VALUES (
    'B2_MORN_FIFE_2', 2, 'B2_MORN_FIFE_2', 'B2 MORNING - FIFE - 24.02.2025 - R2', 'B2', 'FIFE', 'MORNING',
    '2025-02-24', '2025-04-03', 30, '{"days": ["M", "Th"], "time_range": "9:30-12:00"}', 525.0, 'MixTree Languages - Eerste Weteringplantsoen 2c - 1017 SJ Amsterdam', 0,
    'English File Upper Intermediate 4th Edition (ISBN-978-0194039697)', NOW(), NOW()
);
INSERT INTO course_offerings (
    attendance_id, round, course_key, course_full_name, level, program, type,
    start_date, end_date, hours_total, schedule, price, location, online,
    course_book, created_at, updated_at
) VALUES (
    'C1_MORN_FIFE_2', 2, 'C1_MORN_FIFE_2', 'C1 MORNING - FIFE - 25.02.2025 - R2', 'C1', 'FIFE', 'MORNING',
    '2025-02-25', '2025-04-04', 30, '{"days": ["T", "F"], "time_range": "9:30-12:00"}', 525.0, 'MixTree Languages - Eerste Weteringplantsoen 2c - 1017 SJ Amsterdam', 0,
    'English File 4th: Advanced (ISBN-13978-0194038355)', NOW(), NOW()
);
INSERT INTO course_offerings (
    attendance_id, round, course_key, course_full_name, level, program, type,
    start_date, end_date, hours_total, schedule, price, location, online,
    course_book, created_at, updated_at
) VALUES (
    'A2 PR_MORN_FIFE_2', 2, 'A2 PR_MORN_FIFE_2', 'A2 PRE-INT MORNING - FIFE - 25.02.2025 - R2', 'A2 PRE-INT', 'FIFE', 'MORNING',
    '2025-02-25', '2025-04-03', 30, '{"days": ["T", "Th"], "time_range": "9:30-12:00"}', 525.0, 'MixTree Languages - Eerste Weteringplantsoen 2c - 1017 SJ Amsterdam', 0,
    'English File Pre-Intermediate 4th Edition (ISBN-13 978-0194037419)', NOW(), NOW()
);
INSERT INTO course_offerings (
    attendance_id, round, course_key, course_full_name, level, program, type,
    start_date, end_date, hours_total, schedule, price, location, online,
    course_book, created_at, updated_at
) VALUES (
    'B1_MORN_FIFE_2', 2, 'B1_MORN_FIFE_2', 'B1 MORNING - FIFE - 26.02.2025 - R2', 'B1', 'FIFE', 'MORNING',
    '2025-02-26', '2025-04-04', 30, '{"days": ["W", "F"], "time_range": "9:30-12:00"}', 525.0, 'MixTree Languages - Eerste Weteringplantsoen 2c - 1017 SJ Amsterdam', 0,
    'English File Intermediate 4th Edition (ISBN-13978-0194035910)', NOW(), NOW()
);
INSERT INTO course_offerings (
    attendance_id, round, course_key, course_full_name, level, program, type,
    start_date, end_date, hours_total, schedule, price, location, online,
    course_book, created_at, updated_at
) VALUES (
    'B2_INTE_AUCKL_3', 3, 'B2_INTE_AUCKL_3', 'B2 INTENSIVE - AUCKLAND - 10.03.2025 - R3', 'B2', 'AUCKLAND', 'INTENSIVE',
    '2025-03-10', '2025-04-04', 40, '{"days": ["M", "T", "Th", "F"], "time_range": "12:30-15:00"}', 640.0, 'MixTree Languages - Eerste Weteringplantsoen 2c - 1017 SJ Amsterdam', 0,
    'English File Upper Intermediate 4th Edition (ISBN-978-0194039697)', NOW(), NOW()
);
INSERT INTO course_offerings (
    attendance_id, round, course_key, course_full_name, level, program, type,
    start_date, end_date, hours_total, schedule, price, location, online,
    course_book, created_at, updated_at
) VALUES (
    'A2_INTE_AUCKL_3', 3, 'A2_INTE_AUCKL_3', 'A2 INTENSIVE - AUCKLAND - 10.03.2025 - R3', 'A2', 'AUCKLAND', 'INTENSIVE',
    '2025-03-10', '2025-04-04', 40, '{"days": ["M", "T", "Th", "F"], "time_range": "15:30-18:00"}', 640.0, 'MixTree Languages - Eerste Weteringplantsoen 2c - 1017 SJ Amsterdam', 0,
    'English File Pre-Intermediate 4th Edition (ISBN-13 978-0194037419)', NOW(), NOW()
);
INSERT INTO course_offerings (
    attendance_id, round, course_key, course_full_name, level, program, type,
    start_date, end_date, hours_total, schedule, price, location, online,
    course_book, created_at, updated_at
) VALUES (
    'B1_INTE_AUCKL_3', 3, 'B1_INTE_AUCKL_3', 'B1 INTENSIVE - AUCKLAND - 10.03.2025 - R3', 'B1', 'AUCKLAND', 'INTENSIVE',
    '2025-03-10', '2025-04-04', 40, '{"days": ["M", "T", "Th", "F"], "time_range": "9:30-12:00"}', 640.0, 'MixTree Languages - Eerste Weteringplantsoen 2c - 1017 SJ Amsterdam', 0,
    'English File Intermediate 4th Edition (ISBN-13978-0194035910)', NOW(), NOW()
);
INSERT INTO course_offerings (
    attendance_id, round, course_key, course_full_name, level, program, type,
    start_date, end_date, hours_total, schedule, price, location, online,
    course_book, created_at, updated_at
) VALUES (
    'A2 PR_EVE _FIFE_2', 2, 'A2 PR_EVE _FIFE_2', 'A2 PRE-INT EVE ONLINE - FIFE - 11.03.2025 - R2', 'A2 PRE-INT', 'FIFE', 'EVE ONLINE',
    '2025-03-11', '2025-04-17', 24, '{"days": ["T", "F"], "time_range": "19:00-21:00"}', 385.0, 'ONLINE', 1,
    'English File Pre-Intermediate 4th Edition (ISBN-13 978-0194037419)', NOW(), NOW()
);
INSERT INTO course_offerings (
    attendance_id, round, course_key, course_full_name, level, program, type,
    start_date, end_date, hours_total, schedule, price, location, online,
    course_book, created_at, updated_at
) VALUES (
    'BUSIN_EVE _FIFE_2', 2, 'BUSIN_EVE _FIFE_2', 'BUSINESS EVE ONLINE - FIFE - 11.03.2025 - R2', 'BUSINESS', 'FIFE', 'EVE ONLINE',
    '2025-03-11', '2025-04-17', 24, '{"days": ["T", "F"], "time_range": "19:00-21:00"}', 385.0, 'ONLINE', 1,
    'Business Partner B2+ – Pearson Benelux', NOW(), NOW()
);
INSERT INTO course_offerings (
    attendance_id, round, course_key, course_full_name, level, program, type,
    start_date, end_date, hours_total, schedule, price, location, online,
    course_book, created_at, updated_at
) VALUES (
    'C1_EVE _FIFE_2', 2, 'C1_EVE _FIFE_2', 'C1 EVE ONLINE - FIFE - 11.03.2025 - R2', 'C1', 'FIFE', 'EVE ONLINE',
    '2025-03-11', '2025-04-17', 24, '{"days": ["T", "Th"], "time_range": "19:00-21:00"}', 385.0, 'ONLINE', 1,
    'English File 4th: Advanced (ISBN-13978-0194038355)', NOW(), NOW()
);
INSERT INTO course_offerings (
    attendance_id, round, course_key, course_full_name, level, program, type,
    start_date, end_date, hours_total, schedule, price, location, online,
    course_book, created_at, updated_at
) VALUES (
    'B2_EVE _DUBLI_3', 3, 'B2_EVE _DUBLI_3', 'B2 EVE ONLINE - DUBLIN - 07.04.2025 - R3', 'B2', 'DUBLIN', 'EVE ONLINE',
    '2025-04-07', '2025-05-14', 24, '{"days": ["M", "W"], "time_range": "19:00-21:00"}', 385.0, 'ONLINE', 1,
    'English File Upper Intermediate 4th Edition (ISBN-978-0194039697)', NOW(), NOW()
);
INSERT INTO course_offerings (
    attendance_id, round, course_key, course_full_name, level, program, type,
    start_date, end_date, hours_total, schedule, price, location, online,
    course_book, created_at, updated_at
) VALUES (
    'A2 EL_MORN_DUBLI_3', 3, 'A2 EL_MORN_DUBLI_3', 'A2 ELEM MORNING - DUBLIN - 07.04.2025 - R3', 'A2 ELEM', 'DUBLIN', 'MORNING',
    '2025-04-07', '2025-05-14', 30, '{"days": ["M", "W"], "time_range": "9:30-12:00"}', 525.0, 'MixTree Languages - Eerste Weteringplantsoen 2c - 1017 SJ Amsterdam', 0,
    'English File Elementary 4th Edition (ISBN-13978-0194031592)', NOW(), NOW()
);
INSERT INTO course_offerings (
    attendance_id, round, course_key, course_full_name, level, program, type,
    start_date, end_date, hours_total, schedule, price, location, online,
    course_book, created_at, updated_at
) VALUES (
    'A2_INTE_BOSTO_4', 4, 'A2_INTE_BOSTO_4', 'A2 INTENSIVE - BOSTON - 07.04.2025 - R4', 'A2', 'BOSTON', 'INTENSIVE',
    '2025-04-07', '2025-05-02', 40, '{"days": ["M", "T", "Th", "F"], "time_range": "12:30-15:00"}', 640.0, 'MixTree Languages - Eerste Weteringplantsoen 2c - 1017 SJ Amsterdam', 0,
    'English File Pre-Intermediate 4th Edition (ISBN-13 978-0194037419)', NOW(), NOW()
);
INSERT INTO course_offerings (
    attendance_id, round, course_key, course_full_name, level, program, type,
    start_date, end_date, hours_total, schedule, price, location, online,
    course_book, created_at, updated_at
) VALUES (
    'B1_INTE_BOSTO_4', 4, 'B1_INTE_BOSTO_4', 'B1 INTENSIVE - BOSTON - 07.04.2025 - R4', 'B1', 'BOSTON', 'INTENSIVE',
    '2025-04-07', '2025-05-02', 40, '{"days": ["M", "T", "Th", "F"], "time_range": "15:30-18:00"}', 640.0, 'MixTree Languages - Eerste Weteringplantsoen 2c - 1017 SJ Amsterdam', 0,
    'English File Intermediate 4th Edition (ISBN-13978-0194035910)', NOW(), NOW()
);
INSERT INTO course_offerings (
    attendance_id, round, course_key, course_full_name, level, program, type,
    start_date, end_date, hours_total, schedule, price, location, online,
    course_book, created_at, updated_at
) VALUES (
    'B2_INTE_BOSTO_4', 4, 'B2_INTE_BOSTO_4', 'B2 INTENSIVE - BOSTON - 07.04.2025 - R4', 'B2', 'BOSTON', 'INTENSIVE',
    '2025-04-07', '2025-05-02', 40, '{"days": ["M", "T", "Th", "F"], "time_range": "12:30-15:00"}', 640.0, 'MixTree Languages - Eerste Weteringplantsoen 2c - 1017 SJ Amsterdam', 0,
    'English File Upper Intermediate 4th Edition (ISBN-978-0194039697)', NOW(), NOW()
);
INSERT INTO course_offerings (
    attendance_id, round, course_key, course_full_name, level, program, type,
    start_date, end_date, hours_total, schedule, price, location, online,
    course_book, created_at, updated_at
) VALUES (
    'C1_MORN_DUBLI_3', 3, 'C1_MORN_DUBLI_3', 'C1 MORNING - DUBLIN - 08.04.2025 - R3', 'C1', 'DUBLIN', 'MORNING',
    '2025-04-08', '2025-05-16', 30, '{"days": ["T", "F"], "time_range": "9:30-12:00"}', 525.0, 'MixTree Languages - Eerste Weteringplantsoen 2c - 1017 SJ Amsterdam', 0,
    'English File 4th: Advanced (ISBN-13978-0194038355)', NOW(), NOW()
);
INSERT INTO course_offerings (
    attendance_id, round, course_key, course_full_name, level, program, type,
    start_date, end_date, hours_total, schedule, price, location, online,
    course_book, created_at, updated_at
) VALUES (
    'A2 PR_MORN_DUBLI_3', 3, 'A2 PR_MORN_DUBLI_3', 'A2 PRE-INT MORNING - DUBLIN - 08.04.2025 - R3', 'A2 PRE-INT', 'DUBLIN', 'MORNING',
    '2025-04-08', '2025-05-15', 30, '{"days": ["T", "Th"], "time_range": "9:30-12:00"}', 525.0, 'MixTree Languages - Eerste Weteringplantsoen 2c - 1017 SJ Amsterdam', 0,
    'English File Pre-Intermediate 4th Edition (ISBN-13 978-0194037419)', NOW(), NOW()
);
INSERT INTO course_offerings (
    attendance_id, round, course_key, course_full_name, level, program, type,
    start_date, end_date, hours_total, schedule, price, location, online,
    course_book, created_at, updated_at
) VALUES (
    'B1_MORN_DUBLI_3', 3, 'B1_MORN_DUBLI_3', 'B1 MORNING - DUBLIN - 09.04.2025 - R3', 'B1', 'DUBLIN', 'MORNING',
    '2025-04-09', '2025-05-16', 30, '{"days": ["W", "F"], "time_range": "9:30-12:00"}', 525.0, 'MixTree Languages - Eerste Weteringplantsoen 2c - 1017 SJ Amsterdam', 0,
    'English File Intermediate 4th Edition (ISBN-13978-0194035910)', NOW(), NOW()
);
INSERT INTO course_offerings (
    attendance_id, round, course_key, course_full_name, level, program, type,
    start_date, end_date, hours_total, schedule, price, location, online,
    course_book, created_at, updated_at
) VALUES (
    'A2 PR_EVE _DUBLI_3', 3, 'A2 PR_EVE _DUBLI_3', 'A2 PRE-INT EVE ONLINE - DUBLIN - 22.04.2025 - R3', 'A2 PRE-INT', 'DUBLIN', 'EVE ONLINE',
    '2025-04-22', '2025-05-29', 24, '{"days": ["T", "F"], "time_range": "19:00-21:00"}', 385.0, 'ONLINE', 1,
    'English File Pre-Intermediate 4th Edition (ISBN-13 978-0194037419)', NOW(), NOW()
);
INSERT INTO course_offerings (
    attendance_id, round, course_key, course_full_name, level, program, type,
    start_date, end_date, hours_total, schedule, price, location, online,
    course_book, created_at, updated_at
) VALUES (
    'BUSIN_EVE _DUBLI_3', 3, 'BUSIN_EVE _DUBLI_3', 'BUSINESS EVE ONLINE - DUBLIN - 22.04.2025 - R3', 'BUSINESS', 'DUBLIN', 'EVE ONLINE',
    '2025-04-22', '2025-05-29', 18, '{"days": ["T", "F"], "time_range": "19:00-20:30"}', 385.0, 'ONLINE', 1,
    'Business Partner B2+ – Pearson Benelux', NOW(), NOW()
);
INSERT INTO course_offerings (
    attendance_id, round, course_key, course_full_name, level, program, type,
    start_date, end_date, hours_total, schedule, price, location, online,
    course_book, created_at, updated_at
) VALUES (
    'C1_EVE _DUBLI_3', 3, 'C1_EVE _DUBLI_3', 'C1 EVE ONLINE - DUBLIN - 22.04.2025 - R3', 'C1', 'DUBLIN', 'EVE ONLINE',
    '2025-04-22', '2025-05-29', 24, '{"days": ["T", "Th"], "time_range": "19:00-21:00"}', 385.0, 'ONLINE', 1,
    'English File 4th: Advanced (ISBN-13978-0194038355)', NOW(), NOW()
);
INSERT INTO course_offerings (
    attendance_id, round, course_key, course_full_name, level, program, type,
    start_date, end_date, hours_total, schedule, price, location, online,
    course_book, created_at, updated_at
) VALUES (
    'B2_MORN_DUBLI_3', 3, 'B2_MORN_DUBLI_3', 'B2 MORNING - DUBLIN - 22.04.2025 - R3', 'B2', 'DUBLIN', 'MORNING',
    '2025-04-22', '2025-05-28', 30, '{"days": ["M", "Th"], "time_range": "9:30-12:00"}', 525.0, 'MixTree Languages - Eerste Weteringplantsoen 2c - 1017 SJ Amsterdam', 0,
    'English File Upper Intermediate 4th Edition (ISBN-978-0194039697)', NOW(), NOW()
);
INSERT INTO course_offerings (
    attendance_id, round, course_key, course_full_name, level, program, type,
    start_date, end_date, hours_total, schedule, price, location, online,
    course_book, created_at, updated_at
) VALUES (
    'B1_EVE _DUBLI_3', 3, 'B1_EVE _DUBLI_3', 'B1 EVE ONLINE - DUBLIN - 23.04.2025 - R3', 'B1', 'DUBLIN', 'EVE ONLINE',
    '2025-04-23', '2025-05-28', 18, '{"days": ["M", "W"], "time_range": "19:30-21:00"}', 385.0, 'ONLINE', 1,
    'English File Intermediate 4th Edition (ISBN-13978-0194035910)', NOW(), NOW()
);
INSERT INTO course_offerings (
    attendance_id, round, course_key, course_full_name, level, program, type,
    start_date, end_date, hours_total, schedule, price, location, online,
    course_book, created_at, updated_at
) VALUES (
    'A1_BEGI_EDMON_3', 3, 'A1_BEGI_EDMON_3', 'A1 BEGINNER - EDMONTON - 23.04.2025 - R3', 'A1', 'EDMONTON', 'BEGINNER',
    '2025-04-23', '2025-05-28', 24, '{"days": ["M", "W"], "time_range": "15:30-17:30"}', 445.0, 'MixTree Languages - Eerste Weteringplantsoen 2c - 1017 SJ Amsterdam', 0,
    'English File Beginner Student’s Book - 4th Edition (ISBN-13978-0194029803)', NOW(), NOW()
);
INSERT INTO course_offerings (
    attendance_id, round, course_key, course_full_name, level, program, type,
    start_date, end_date, hours_total, schedule, price, location, online,
    course_book, created_at, updated_at
) VALUES (
    'A2_INTE_CAPE _5', 5, 'A2_INTE_CAPE _5', 'A2 INTENSIVE - CAPE TOWN - 05.05.2025 - R5', 'A2', 'CAPE TOWN', 'INTENSIVE',
    '2025-05-05', '2025-05-30', 40, '{"days": ["M", "T", "Th", "F"], "time_range": "15:30-18:00"}', 640.0, 'MixTree Languages - Eerste Weteringplantsoen 2c - 1017 SJ Amsterdam', 0,
    'English File Pre-Intermediate 4th Edition (ISBN-13 978-0194037419)', NOW(), NOW()
);
INSERT INTO course_offerings (
    attendance_id, round, course_key, course_full_name, level, program, type,
    start_date, end_date, hours_total, schedule, price, location, online,
    course_book, created_at, updated_at
) VALUES (
    'B1_INTE_CAPE _5', 5, 'B1_INTE_CAPE _5', 'B1 INTENSIVE - CAPE TOWN - 06.05.2025 - R5', 'B1', 'CAPE TOWN', 'INTENSIVE',
    '2025-05-06', '2025-05-30', 40, '{"days": ["M", "T", "Th", "F"], "time_range": "12:30-15:00"}', 640.0, 'MixTree Languages - Eerste Weteringplantsoen 2c - 1017 SJ Amsterdam', 0,
    'English File Intermediate 4th Edition (ISBN-13978-0194035910)', NOW(), NOW()
);
INSERT INTO course_offerings (
    attendance_id, round, course_key, course_full_name, level, program, type,
    start_date, end_date, hours_total, schedule, price, location, online,
    course_book, created_at, updated_at
) VALUES (
    'B2_INTE_CAPE _5', 5, 'B2_INTE_CAPE _5', 'B2 INTENSIVE - CAPE TOWN - 06.05.2025 - R5', 'B2', 'CAPE TOWN', 'INTENSIVE',
    '2025-05-06', '2025-05-30', 40, '{"days": ["M", "T", "Th", "F"], "time_range": "12:30-15:00"}', 640.0, 'MixTree Languages - Eerste Weteringplantsoen 2c - 1017 SJ Amsterdam', 0,
    'English File Upper Intermediate 4th Edition (ISBN-978-0194039697)', NOW(), NOW()
);
INSERT INTO course_offerings (
    attendance_id, round, course_key, course_full_name, level, program, type,
    start_date, end_date, hours_total, schedule, price, location, online,
    course_book, created_at, updated_at
) VALUES (
    'B2_EVE _EDMON_4', 4, 'B2_EVE _EDMON_4', 'B2 EVE ONLINE - EDMONTON - 19.05.2025 - R4', 'B2', 'EDMONTON', 'EVE ONLINE',
    '2025-05-19', '2025-06-25', 24, '{"days": ["M", "W"], "time_range": "19:00-21:00"}', 385.0, 'ONLINE', 1,
    'English File Upper Intermediate 4th Edition (ISBN-978-0194039697)', NOW(), NOW()
);
INSERT INTO course_offerings (
    attendance_id, round, course_key, course_full_name, level, program, type,
    start_date, end_date, hours_total, schedule, price, location, online,
    course_book, created_at, updated_at
) VALUES (
    'A2 EL_MORN_EDMON_4', 4, 'A2 EL_MORN_EDMON_4', 'A2 ELEM MORNING - EDMONTON - 19.05.2025 - R4', 'A2 ELEM', 'EDMONTON', 'MORNING',
    '2025-05-19', '2025-06-25', 30, '{"days": ["M", "W"], "time_range": "9:30-12:00"}', 525.0, 'MixTree Languages - Eerste Weteringplantsoen 2c - 1017 SJ Amsterdam', 0,
    'English File Elementary 4th Edition (ISBN-13978-0194031592)', NOW(), NOW()
);
INSERT INTO course_offerings (
    attendance_id, round, course_key, course_full_name, level, program, type,
    start_date, end_date, hours_total, schedule, price, location, online,
    course_book, created_at, updated_at
) VALUES (
    'C1_MORN_EDMON_4', 4, 'C1_MORN_EDMON_4', 'C1 MORNING - EDMONTON - 20.05.2025 - R4', 'C1', 'EDMONTON', 'MORNING',
    '2025-05-20', '2025-06-27', 30, '{"days": ["T", "F"], "time_range": "9:30-12:00"}', 525.0, 'MixTree Languages - Eerste Weteringplantsoen 2c - 1017 SJ Amsterdam', 0,
    'English File 4th: Advanced (ISBN-13978-0194038355)', NOW(), NOW()
);
INSERT INTO course_offerings (
    attendance_id, round, course_key, course_full_name, level, program, type,
    start_date, end_date, hours_total, schedule, price, location, online,
    course_book, created_at, updated_at
) VALUES (
    'A2 PR_MORN_EDMON_4', 4, 'A2 PR_MORN_EDMON_4', 'A2 PRE-INT MORNING - EDMONTON - 20.05.2025 - R4', 'A2 PRE-INT', 'EDMONTON', 'MORNING',
    '2025-05-20', '2025-06-26', 30, '{"days": ["T", "Th"], "time_range": "9:30-12:00"}', 525.0, 'MixTree Languages - Eerste Weteringplantsoen 2c - 1017 SJ Amsterdam', 0,
    'English File Pre-Intermediate 4th Edition (ISBN-13 978-0194037419)', NOW(), NOW()
);
INSERT INTO course_offerings (
    attendance_id, round, course_key, course_full_name, level, program, type,
    start_date, end_date, hours_total, schedule, price, location, online,
    course_book, created_at, updated_at
) VALUES (
    'B1_EVE _EDMON_4', 4, 'B1_EVE _EDMON_4', 'B1 EVE ONLINE - EDMONTON - 02.06.2025 - R4', 'B1', 'EDMONTON', 'EVE ONLINE',
    '2025-06-02', '2025-07-09', 24, '{"days": ["M", "W"], "time_range": "19:00-21:00"}', 385.0, 'ONLINE', 1,
    'English File Intermediate 4th Edition (ISBN-13978-0194035910)', NOW(), NOW()
);
INSERT INTO course_offerings (
    attendance_id, round, course_key, course_full_name, level, program, type,
    start_date, end_date, hours_total, schedule, price, location, online,
    course_book, created_at, updated_at
) VALUES (
    'A1_BEGI_DUBLI_4', 4, 'A1_BEGI_DUBLI_4', 'A1 BEGINNER - DUBLIN - 02.06.2025 - R4', 'A1', 'DUBLIN', 'BEGINNER',
    '2025-06-02', '2025-07-09', 24, '{"days": ["M", "W"], "time_range": "15:30-17:30"}', 445.0, 'MixTree Languages - Eerste Weteringplantsoen 2c - 1017 SJ Amsterdam', 0,
    'English File Beginner Student’s Book - 4th Edition (ISBN-13978-0194029803)', NOW(), NOW()
);
INSERT INTO course_offerings (
    attendance_id, round, course_key, course_full_name, level, program, type,
    start_date, end_date, hours_total, schedule, price, location, online,
    course_book, created_at, updated_at
) VALUES (
    'B2_MORN_EDMON_4', 4, 'B2_MORN_EDMON_4', 'B2 MORNING - EDMONTON - 02.06.2025 - R4', 'B2', 'EDMONTON', 'MORNING',
    '2025-06-02', '2025-07-10', 30, '{"days": ["M", "Th"], "time_range": "9:30-12:00"}', 525.0, 'MixTree Languages - Eerste Weteringplantsoen 2c - 1017 SJ Amsterdam', 0,
    'English File Upper Intermediate 4th Edition (ISBN-978-0194039697)', NOW(), NOW()
);
INSERT INTO course_offerings (
    attendance_id, round, course_key, course_full_name, level, program, type,
    start_date, end_date, hours_total, schedule, price, location, online,
    course_book, created_at, updated_at
) VALUES (
    'A2_INTE_AUCKL_6', 6, 'A2_INTE_AUCKL_6', 'A2 INTENSIVE - AUCKLAND - 02.06.2025 - R6', 'A2', 'AUCKLAND', 'INTENSIVE',
    '2025-06-02', '2025-06-27', 40, '{"days": ["M", "T", "Th", "F"], "time_range": "12:30-15:00"}', 640.0, 'MixTree Languages - Eerste Weteringplantsoen 2c - 1017 SJ Amsterdam', 0,
    'English File Pre-Intermediate 4th Edition (ISBN-13 978-0194037419)', NOW(), NOW()
);
INSERT INTO course_offerings (
    attendance_id, round, course_key, course_full_name, level, program, type,
    start_date, end_date, hours_total, schedule, price, location, online,
    course_book, created_at, updated_at
) VALUES (
    'B1_INTE_AUCKL_6', 6, 'B1_INTE_AUCKL_6', 'B1 INTENSIVE - AUCKLAND - 02.06.2025 - R6', 'B1', 'AUCKLAND', 'INTENSIVE',
    '2025-06-02', '2025-06-27', 40, '{"days": ["M", "T", "Th", "F"], "time_range": "12:30-15:00"}', 640.0, 'MixTree Languages - Eerste Weteringplantsoen 2c - 1017 SJ Amsterdam', 0,
    'English File Intermediate 4th Edition (ISBN-13978-0194035910)', NOW(), NOW()
);
INSERT INTO course_offerings (
    attendance_id, round, course_key, course_full_name, level, program, type,
    start_date, end_date, hours_total, schedule, price, location, online,
    course_book, created_at, updated_at
) VALUES (
    'B2_INTE_AUCKL_6', 6, 'B2_INTE_AUCKL_6', 'B2 INTENSIVE - AUCKLAND - 02.06.2025 - R6', 'B2', 'AUCKLAND', 'INTENSIVE',
    '2025-06-02', '2025-06-27', 40, '{"days": ["M", "T", "Th", "F"], "time_range": "15:30-18:00"}', 640.0, 'MixTree Languages - Eerste Weteringplantsoen 2c - 1017 SJ Amsterdam', 0,
    'English File Upper Intermediate 4th Edition (ISBN-978-0194039697)', NOW(), NOW()
);
INSERT INTO course_offerings (
    attendance_id, round, course_key, course_full_name, level, program, type,
    start_date, end_date, hours_total, schedule, price, location, online,
    course_book, created_at, updated_at
) VALUES (
    'BUSIN_EVE _EDMON_4', 4, 'BUSIN_EVE _EDMON_4', 'BUSINESS EVE ONLINE - EDMONTON - 03.06.2025 - R4', 'BUSINESS', 'EDMONTON', 'EVE ONLINE',
    '2025-06-03', '2025-07-10', 24, '{"days": ["T", "F"], "time_range": "19:00-21:00"}', 385.0, 'ONLINE', 1,
    'Business Partner B2+ – Pearson Benelux', NOW(), NOW()
);
INSERT INTO course_offerings (
    attendance_id, round, course_key, course_full_name, level, program, type,
    start_date, end_date, hours_total, schedule, price, location, online,
    course_book, created_at, updated_at
) VALUES (
    'C1_EVE _EDMON_4', 4, 'C1_EVE _EDMON_4', 'C1 EVE ONLINE - EDMONTON - 03.06.2025 - R4', 'C1', 'EDMONTON', 'EVE ONLINE',
    '2025-06-03', '2025-07-10', 24, '{"days": ["T", "Th"], "time_range": "19:00-21:00"}', 385.0, 'ONLINE', 1,
    'English File 4th: Advanced (ISBN-13978-0194038355)', NOW(), NOW()
);
INSERT INTO course_offerings (
    attendance_id, round, course_key, course_full_name, level, program, type,
    start_date, end_date, hours_total, schedule, price, location, online,
    course_book, created_at, updated_at
) VALUES (
    'B1_MORN_EDMON_4', 4, 'B1_MORN_EDMON_4', 'B1 MORNING - EDMONTON - 04.06.2025 - R4', 'B1', 'EDMONTON', 'MORNING',
    '2025-06-04', '2025-07-11', 30, '{"days": ["W", "F"], "time_range": "9:30-12:00"}', 525.0, 'MixTree Languages - Eerste Weteringplantsoen 2c - 1017 SJ Amsterdam', 0,
    'English File Intermediate 4th Edition (ISBN-13978-0194035910)', NOW(), NOW()
);
INSERT INTO course_offerings (
    attendance_id, round, course_key, course_full_name, level, program, type,
    start_date, end_date, hours_total, schedule, price, location, online,
    course_book, created_at, updated_at
) VALUES (
    'A2 PR_EVE _EDMON_4', 4, 'A2 PR_EVE _EDMON_4', 'A2 PRE-INT EVE ONLINE - EDMONTON - 17.06.2025 - R4', 'A2 PRE-INT', 'EDMONTON', 'EVE ONLINE',
    '2025-06-17', '2025-07-24', 24, '{"days": ["T", "F"], "time_range": "19:00-21:00"}', 385.0, 'ONLINE', 1,
    'English File Pre-Intermediate 4th Edition (ISBN-13 978-0194037419)', NOW(), NOW()
);
INSERT INTO course_offerings (
    attendance_id, round, course_key, course_full_name, level, program, type,
    start_date, end_date, hours_total, schedule, price, location, online,
    course_book, created_at, updated_at
) VALUES (
    'B2_EVE _FIFE_5', 5, 'B2_EVE _FIFE_5', 'B2 EVE ONLINE - FIFE - 30.06.2025 - R5', 'B2', 'FIFE', 'EVE ONLINE',
    '2025-06-30', '2025-08-06', 24, '{"days": ["M", "W"], "time_range": "19:00-21:00"}', 385.0, 'ONLINE', 1,
    'English File Upper Intermediate 4th Edition (ISBN-978-0194039697)', NOW(), NOW()
);
INSERT INTO course_offerings (
    attendance_id, round, course_key, course_full_name, level, program, type,
    start_date, end_date, hours_total, schedule, price, location, online,
    course_book, created_at, updated_at
) VALUES (
    'A2 EL_MORN_FIFE_5', 5, 'A2 EL_MORN_FIFE_5', 'A2 ELEM MORNING - FIFE - 30.06.2025 - R5', 'A2 ELEM', 'FIFE', 'MORNING',
    '2025-06-30', '2025-08-06', 30, '{"days": ["M", "W"], "time_range": "9:30-12:00"}', 525.0, 'MixTree Languages - Eerste Weteringplantsoen 2c - 1017 SJ Amsterdam', 0,
    'English File Elementary 4th Edition (ISBN-13978-0194031592)', NOW(), NOW()
);
INSERT INTO course_offerings (
    attendance_id, round, course_key, course_full_name, level, program, type,
    start_date, end_date, hours_total, schedule, price, location, online,
    course_book, created_at, updated_at
) VALUES (
    'A2_INTE_BOSTO_7', 7, 'A2_INTE_BOSTO_7', 'A2 INTENSIVE - BOSTON - 30.06.2025 - R7', 'A2', 'BOSTON', 'INTENSIVE',
    '2025-06-30', '2025-07-25', 40, '{"days": ["M", "T", "Th", "F"], "time_range": "15:30-18:00"}', 640.0, 'MixTree Languages - Eerste Weteringplantsoen 2c - 1017 SJ Amsterdam', 0,
    'English File Pre-Intermediate 4th Edition (ISBN-13 978-0194037419)', NOW(), NOW()
);
INSERT INTO course_offerings (
    attendance_id, round, course_key, course_full_name, level, program, type,
    start_date, end_date, hours_total, schedule, price, location, online,
    course_book, created_at, updated_at
) VALUES (
    'B1_INTE_BOSTO_7', 7, 'B1_INTE_BOSTO_7', 'B1 INTENSIVE - BOSTON - 30.06.2025 - R7', 'B1', 'BOSTON', 'INTENSIVE',
    '2025-06-30', '2025-07-25', 40, '{"days": ["M", "T", "Th", "F"], "time_range": "12:30-15:00"}', 640.0, 'MixTree Languages - Eerste Weteringplantsoen 2c - 1017 SJ Amsterdam', 0,
    'English File Intermediate 4th Edition (ISBN-13978-0194035910)', NOW(), NOW()
);
INSERT INTO course_offerings (
    attendance_id, round, course_key, course_full_name, level, program, type,
    start_date, end_date, hours_total, schedule, price, location, online,
    course_book, created_at, updated_at
) VALUES (
    'B2_INTE_BOSTO_7', 7, 'B2_INTE_BOSTO_7', 'B2 INTENSIVE - BOSTON - 30.06.2025 - R7', 'B2', 'BOSTON', 'INTENSIVE',
    '2025-06-30', '2025-07-25', 40, '{"days": ["M", "T", "Th", "F"], "time_range": "12:30-15:00"}', 640.0, 'MixTree Languages - Eerste Weteringplantsoen 2c - 1017 SJ Amsterdam', 0,
    'English File Upper Intermediate 4th Edition (ISBN-978-0194039697)', NOW(), NOW()
);
INSERT INTO course_offerings (
    attendance_id, round, course_key, course_full_name, level, program, type,
    start_date, end_date, hours_total, schedule, price, location, online,
    course_book, created_at, updated_at
) VALUES (
    'C1_MORN_FIFE_5', 5, 'C1_MORN_FIFE_5', 'C1 MORNING - FIFE - 01.07.2025 - R5', 'C1', 'FIFE', 'MORNING',
    '2025-07-01', '2025-08-08', 30, '{"days": ["T", "F"], "time_range": "9:30-12:00"}', 525.0, 'MixTree Languages - Eerste Weteringplantsoen 2c - 1017 SJ Amsterdam', 0,
    'English File 4th: Advanced (ISBN-13978-0194038355)', NOW(), NOW()
);
INSERT INTO course_offerings (
    attendance_id, round, course_key, course_full_name, level, program, type,
    start_date, end_date, hours_total, schedule, price, location, online,
    course_book, created_at, updated_at
) VALUES (
    'A2 PR_MORN_FIFE_5', 5, 'A2 PR_MORN_FIFE_5', 'A2 PRE-INT MORNING - FIFE - 01.07.2025 - R5', 'A2 PRE-INT', 'FIFE', 'MORNING',
    '2025-07-01', '2025-08-07', 30, '{"days": ["T", "Th"], "time_range": "9:30-12:00"}', 525.0, 'MixTree Languages - Eerste Weteringplantsoen 2c - 1017 SJ Amsterdam', 0,
    'English File Pre-Intermediate 4th Edition (ISBN-13 978-0194037419)', NOW(), NOW()
);
INSERT INTO course_offerings (
    attendance_id, round, course_key, course_full_name, level, program, type,
    start_date, end_date, hours_total, schedule, price, location, online,
    course_book, created_at, updated_at
) VALUES (
    'B1_EVE _FIFE_5', 5, 'B1_EVE _FIFE_5', 'B1 EVE ONLINE - FIFE - 14.07.2025 - R5', 'B1', 'FIFE', 'EVE ONLINE',
    '2025-07-14', '2025-08-20', 24, '{"days": ["M", "W"], "time_range": "19:00-21:00"}', 385.0, 'ONLINE', 1,
    'English File Intermediate 4th Edition (ISBN-13978-0194035910)', NOW(), NOW()
);
INSERT INTO course_offerings (
    attendance_id, round, course_key, course_full_name, level, program, type,
    start_date, end_date, hours_total, schedule, price, location, online,
    course_book, created_at, updated_at
) VALUES (
    'A1_BEGI_EDMON_5', 5, 'A1_BEGI_EDMON_5', 'A1 BEGINNER - EDMONTON - 14.07.2025 - R5', 'A1', 'EDMONTON', 'BEGINNER',
    '2025-07-14', '2025-07-30', 24, '{"days": ["M", "W"], "time_range": "15:30-17:30"}', 445.0, 'MixTree Languages - Eerste Weteringplantsoen 2c - 1017 SJ Amsterdam', 0,
    'English File Beginner Student’s Book - 4th Edition (ISBN-13978-0194029803)', NOW(), NOW()
);
INSERT INTO course_offerings (
    attendance_id, round, course_key, course_full_name, level, program, type,
    start_date, end_date, hours_total, schedule, price, location, online,
    course_book, created_at, updated_at
) VALUES (
    'B2_MORN_FIFE_5', 5, 'B2_MORN_FIFE_5', 'B2 MORNING - FIFE - 14.07.2025 - R5', 'B2', 'FIFE', 'MORNING',
    '2025-07-14', '2025-08-21', 30, '{"days": ["M", "Th"], "time_range": "9:30-12:00"}', 525.0, 'MixTree Languages - Eerste Weteringplantsoen 2c - 1017 SJ Amsterdam', 0,
    'English File Upper Intermediate 4th Edition (ISBN-978-0194039697)', NOW(), NOW()
);
INSERT INTO course_offerings (
    attendance_id, round, course_key, course_full_name, level, program, type,
    start_date, end_date, hours_total, schedule, price, location, online,
    course_book, created_at, updated_at
) VALUES (
    'A2 PR_EVE _FIFE_5', 5, 'A2 PR_EVE _FIFE_5', 'A2 PRE-INT EVE ONLINE - FIFE - 15.07.2025 - R5', 'A2 PRE-INT', 'FIFE', 'EVE ONLINE',
    '2025-07-15', '2025-08-14', 20, '{"days": ["T", "F"], "time_range": "19:00-21:00"}', 385.0, 'ONLINE', 1,
    'English File Pre-Intermediate 4th Edition (ISBN-13 978-0194037419)', NOW(), NOW()
);
INSERT INTO course_offerings (
    attendance_id, round, course_key, course_full_name, level, program, type,
    start_date, end_date, hours_total, schedule, price, location, online,
    course_book, created_at, updated_at
) VALUES (
    'BUSIN_EVE _FIFE_5', 5, 'BUSIN_EVE _FIFE_5', 'BUSINESS EVE ONLINE - FIFE - 15.07.2025 - R5', 'BUSINESS', 'FIFE', 'EVE ONLINE',
    '2025-07-15', '2025-08-21', 20, '{"days": ["T", "Th"], "time_range": "19:00-21:00"}', 385.0, 'ONLINE', 1,
    'Business Partner B2+ – Pearson Benelux', NOW(), NOW()
);
INSERT INTO course_offerings (
    attendance_id, round, course_key, course_full_name, level, program, type,
    start_date, end_date, hours_total, schedule, price, location, online,
    course_book, created_at, updated_at
) VALUES (
    'C1_EVE _FIFE_5', 5, 'C1_EVE _FIFE_5', 'C1 EVE ONLINE - FIFE - 15.07.2025 - R5', 'C1', 'FIFE', 'EVE ONLINE',
    '2025-07-15', '2025-08-21', 24, '{"days": ["T", "Th"], "time_range": "19:00-21:00"}', 385.0, 'ONLINE', 1,
    'English File 4th: Advanced (ISBN-13978-0194038355)', NOW(), NOW()
);
INSERT INTO course_offerings (
    attendance_id, round, course_key, course_full_name, level, program, type,
    start_date, end_date, hours_total, schedule, price, location, online,
    course_book, created_at, updated_at
) VALUES (
    'B1_MORN_FIFE_5', 5, 'B1_MORN_FIFE_5', 'B1 MORNING - FIFE - 16.07.2025 - R5', 'B1', 'FIFE', 'MORNING',
    '2025-07-16', '2025-08-22', 30, '{"days": ["W", "F"], "time_range": "9:30-12:00"}', 525.0, 'MixTree Languages - Eerste Weteringplantsoen 2c - 1017 SJ Amsterdam', 0,
    'English File Intermediate 4th Edition (ISBN-13978-0194035910)', NOW(), NOW()
);
INSERT INTO course_offerings (
    attendance_id, round, course_key, course_full_name, level, program, type,
    start_date, end_date, hours_total, schedule, price, location, online,
    course_book, created_at, updated_at
) VALUES (
    'A2_INTE_CAPE _8', 8, 'A2_INTE_CAPE _8', 'A2 INTENSIVE - CAPE TOWN - 28.07.2025 - R8', 'A2', 'CAPE TOWN', 'INTENSIVE',
    '2025-07-28', '2025-08-22', 40, '{"days": ["M", "T", "Th", "F"], "time_range": "12:30-15:00"}', 640.0, 'MixTree Languages - Eerste Weteringplantsoen 2c - 1017 SJ Amsterdam', 0,
    'English File Pre-Intermediate 4th Edition (ISBN-13 978-0194037419)', NOW(), NOW()
);
INSERT INTO course_offerings (
    attendance_id, round, course_key, course_full_name, level, program, type,
    start_date, end_date, hours_total, schedule, price, location, online,
    course_book, created_at, updated_at
) VALUES (
    'B1_INTE_CAPE _8', 8, 'B1_INTE_CAPE _8', 'B1 INTENSIVE - CAPE TOWN - 28.07.2025 - R8', 'B1', 'CAPE TOWN', 'INTENSIVE',
    '2025-07-28', '2025-08-22', 40, '{"days": ["M", "T", "Th", "F"], "time_range": "15:30-18:00"}', 640.0, 'MixTree Languages - Eerste Weteringplantsoen 2c - 1017 SJ Amsterdam', 0,
    'English File Intermediate 4th Edition (ISBN-13978-0194035910)', NOW(), NOW()
);
INSERT INTO course_offerings (
    attendance_id, round, course_key, course_full_name, level, program, type,
    start_date, end_date, hours_total, schedule, price, location, online,
    course_book, created_at, updated_at
) VALUES (
    'B2_INTE_CAPE _8', 8, 'B2_INTE_CAPE _8', 'B2 INTENSIVE - CAPE TOWN - 28.07.2025 - R8', 'B2', 'CAPE TOWN', 'INTENSIVE',
    '2025-07-28', '2025-08-22', 40, '{"days": ["M", "T", "Th", "F"], "time_range": "12:30-15:00"}', 640.0, 'MixTree Languages - Eerste Weteringplantsoen 2c - 1017 SJ Amsterdam', 0,
    'English File Upper Intermediate 4th Edition (ISBN-978-0194039697)', NOW(), NOW()
);
INSERT INTO course_offerings (
    attendance_id, round, course_key, course_full_name, level, program, type,
    start_date, end_date, hours_total, schedule, price, location, online,
    course_book, created_at, updated_at
) VALUES (
    'B1_EVE _DUBLI_6', 6, 'B1_EVE _DUBLI_6', 'B1 EVE ONLINE - DUBLIN - 18.08.2025 - R6', 'B1', 'DUBLIN', 'EVE ONLINE',
    '2025-08-18', '2025-09-24', 24, '{"days": ["M", "W"], "time_range": "19:00-21:00"}', 385.0, 'ONLINE', 1,
    'English File Intermediate 4th Edition (ISBN-13978-0194035910)', NOW(), NOW()
);
INSERT INTO course_offerings (
    attendance_id, round, course_key, course_full_name, level, program, type,
    start_date, end_date, hours_total, schedule, price, location, online,
    course_book, created_at, updated_at
) VALUES (
    'A1_BEGI_DUBLI_6', 6, 'A1_BEGI_DUBLI_6', 'A1 BEGINNER - DUBLIN - 18.08.2025 - R6', 'A1', 'DUBLIN', 'BEGINNER',
    '2025-08-18', '2025-09-24', 24, '{"days": ["M", "W"], "time_range": "15:30-17:30"}', 445.0, 'MixTree Languages - Eerste Weteringplantsoen 2c - 1017 SJ Amsterdam', 0,
    'English File Beginner Student’s Book - 4th Edition (ISBN-13978-0194029803)', NOW(), NOW()
);
INSERT INTO course_offerings (
    attendance_id, round, course_key, course_full_name, level, program, type,
    start_date, end_date, hours_total, schedule, price, location, online,
    course_book, created_at, updated_at
) VALUES (
    'A2 EL_MORN_DUBLI_6', 6, 'A2 EL_MORN_DUBLI_6', 'A2 ELEM MORNING - DUBLIN - 18.08.2025 - R6', 'A2 ELEM', 'DUBLIN', 'MORNING',
    '2025-08-18', '2025-09-24', 30, '{"days": ["M", "W"], "time_range": "9:30-12:00"}', 525.0, 'MixTree Languages - Eerste Weteringplantsoen 2c - 1017 SJ Amsterdam', 0,
    'English File Elementary 4th Edition (ISBN-13978-0194031592)', NOW(), NOW()
);
INSERT INTO course_offerings (
    attendance_id, round, course_key, course_full_name, level, program, type,
    start_date, end_date, hours_total, schedule, price, location, online,
    course_book, created_at, updated_at
) VALUES (
    'C1_MORN_DUBLI_6', 6, 'C1_MORN_DUBLI_6', 'C1 MORNING - DUBLIN - 19.08.2025 - R6', 'C1', 'DUBLIN', 'MORNING',
    '2025-08-19', '2025-09-26', 25, '{"days": ["T", "F"], "time_range": "9:30-12:00"}', 525.0, 'MixTree Languages - Eerste Weteringplantsoen 2c - 1017 SJ Amsterdam', 0,
    'English File 4th: Advanced (ISBN-13978-0194038355)', NOW(), NOW()
);
INSERT INTO course_offerings (
    attendance_id, round, course_key, course_full_name, level, program, type,
    start_date, end_date, hours_total, schedule, price, location, online,
    course_book, created_at, updated_at
) VALUES (
    'A2 PR_MORN_DUBLI_6', 6, 'A2 PR_MORN_DUBLI_6', 'A2 PRE-INT MORNING - DUBLIN - 19.08.2025 - R6', 'A2 PRE-INT', 'DUBLIN', 'MORNING',
    '2025-08-19', '2025-09-25', 30, '{"days": ["T", "Th"], "time_range": "9:30-12:00"}', 525.0, 'MixTree Languages - Eerste Weteringplantsoen 2c - 1017 SJ Amsterdam', 0,
    'English File Pre-Intermediate 4th Edition (ISBN-13 978-0194037419)', NOW(), NOW()
);
INSERT INTO course_offerings (
    attendance_id, round, course_key, course_full_name, level, program, type,
    start_date, end_date, hours_total, schedule, price, location, online,
    course_book, created_at, updated_at
) VALUES (
    'B2_EVE _DUBLI_6', 6, 'B2_EVE _DUBLI_6', 'B2 EVE ONLINE - DUBLIN - 25.08.2025 - R6', 'B2', 'DUBLIN', 'EVE ONLINE',
    '2025-08-25', '2025-10-01', 24, '{"days": ["M", "W"], "time_range": "19:00-21:00"}', 385.0, 'ONLINE', 1,
    'English File Upper Intermediate 4th Edition (ISBN-978-0194039697)', NOW(), NOW()
);
INSERT INTO course_offerings (
    attendance_id, round, course_key, course_full_name, level, program, type,
    start_date, end_date, hours_total, schedule, price, location, online,
    course_book, created_at, updated_at
) VALUES (
    'B2_MORN_DUBLI_6', 6, 'B2_MORN_DUBLI_6', 'B2 MORNING - DUBLIN - 25.08.2025 - R6', 'B2', 'DUBLIN', 'MORNING',
    '2025-08-25', '2025-10-02', 30, '{"days": ["M", "Th"], "time_range": "9:30-12:00"}', 525.0, 'MixTree Languages - Eerste Weteringplantsoen 2c - 1017 SJ Amsterdam', 0,
    'English File Upper Intermediate 4th Edition (ISBN-978-0194039697)', NOW(), NOW()
);
INSERT INTO course_offerings (
    attendance_id, round, course_key, course_full_name, level, program, type,
    start_date, end_date, hours_total, schedule, price, location, online,
    course_book, created_at, updated_at
) VALUES (
    'A2 PR_EVE _DUBLI_6', 6, 'A2 PR_EVE _DUBLI_6', 'A2 PRE-INT EVE ONLINE - DUBLIN - 26.08.2025 - R6', 'A2 PRE-INT', 'DUBLIN', 'EVE ONLINE',
    '2025-08-26', '2025-10-14', 24, '{"days": ["T", "F"], "time_range": "19:00-21:00"}', 385.0, 'ONLINE', 1,
    'English File Pre-Intermediate 4th Edition (ISBN-13 978-0194037419)', NOW(), NOW()
);
INSERT INTO course_offerings (
    attendance_id, round, course_key, course_full_name, level, program, type,
    start_date, end_date, hours_total, schedule, price, location, online,
    course_book, created_at, updated_at
) VALUES (
    'BUSIN_EVE _DUBLI_6', 6, 'BUSIN_EVE _DUBLI_6', 'BUSINESS EVE ONLINE - DUBLIN - 26.08.2025 - R6', 'BUSINESS', 'DUBLIN', 'EVE ONLINE',
    '2025-08-26', '2025-10-02', 24, '{"days": ["T", "F"], "time_range": "19:00-21:00"}', 385.0, 'ONLINE', 1,
    'Business Partner B2+ – Pearson Benelux', NOW(), NOW()
);
INSERT INTO course_offerings (
    attendance_id, round, course_key, course_full_name, level, program, type,
    start_date, end_date, hours_total, schedule, price, location, online,
    course_book, created_at, updated_at
) VALUES (
    'C1_EVE _DUBLI_6', 6, 'C1_EVE _DUBLI_6', 'C1 EVE ONLINE - DUBLIN - 26.08.2025 - R6', 'C1', 'DUBLIN', 'EVE ONLINE',
    '2025-08-26', '2025-10-02', 24, '{"days": ["T", "Th"], "time_range": "19:00-21:00"}', 385.0, 'ONLINE', 1,
    'English File 4th: Advanced (ISBN-13978-0194038355)', NOW(), NOW()
);
INSERT INTO course_offerings (
    attendance_id, round, course_key, course_full_name, level, program, type,
    start_date, end_date, hours_total, schedule, price, location, online,
    course_book, created_at, updated_at
) VALUES (
    'B1_MORN_DUBLI_6', 6, 'B1_MORN_DUBLI_6', 'B1 MORNING - DUBLIN - 27.08.2025 - R6', 'B1', 'DUBLIN', 'MORNING',
    '2025-08-27', '2025-10-03', 30, '{"days": ["W", "F"], "time_range": "9:30-12:00"}', 525.0, 'MixTree Languages - Eerste Weteringplantsoen 2c - 1017 SJ Amsterdam', 0,
    'English File Intermediate 4th Edition (ISBN-13978-0194035910)', NOW(), NOW()
);
INSERT INTO course_offerings (
    attendance_id, round, course_key, course_full_name, level, program, type,
    start_date, end_date, hours_total, schedule, price, location, online,
    course_book, created_at, updated_at
) VALUES (
    'A2_INTE_AUCKL_9', 9, 'A2_INTE_AUCKL_9', 'A2 INTENSIVE - AUCKLAND - 01.09.2025 - R9', 'A2', 'AUCKLAND', 'INTENSIVE',
    '2025-09-01', '2025-09-26', 40, '{"days": ["M", "T", "Th", "F"], "time_range": "12:30-15:00"}', 640.0, 'MixTree Languages - Eerste Weteringplantsoen 2c - 1017 SJ Amsterdam', 0,
    'English File Pre-Intermediate 4th Edition (ISBN-13 978-0194037419)', NOW(), NOW()
);
INSERT INTO course_offerings (
    attendance_id, round, course_key, course_full_name, level, program, type,
    start_date, end_date, hours_total, schedule, price, location, online,
    course_book, created_at, updated_at
) VALUES (
    'B1_INTE_AUCKL_9', 9, 'B1_INTE_AUCKL_9', 'B1 INTENSIVE - AUCKLAND - 01.09.2025 - R9', 'B1', 'AUCKLAND', 'INTENSIVE',
    '2025-09-01', '2025-09-26', 40, '{"days": ["M", "T", "Th", "F"], "time_range": "12:30-15:00"}', 640.0, 'MixTree Languages - Eerste Weteringplantsoen 2c - 1017 SJ Amsterdam', 0,
    'English File Intermediate 4th Edition (ISBN-13978-0194035910)', NOW(), NOW()
);
INSERT INTO course_offerings (
    attendance_id, round, course_key, course_full_name, level, program, type,
    start_date, end_date, hours_total, schedule, price, location, online,
    course_book, created_at, updated_at
) VALUES (
    'B2_INTE_AUCKL_9', 9, 'B2_INTE_AUCKL_9', 'B2 INTENSIVE - AUCKLAND - 01.09.2025 - R9', 'B2', 'AUCKLAND', 'INTENSIVE',
    '2025-09-01', '2025-09-26', 40, '{"days": ["M", "T", "Th", "F"], "time_range": "15:30-18:00"}', 640.0, 'MixTree Languages - Eerste Weteringplantsoen 2c - 1017 SJ Amsterdam', 0,
    'English File Upper Intermediate 4th Edition (ISBN-978-0194039697)', NOW(), NOW()
);
INSERT INTO course_offerings (
    attendance_id, round, course_key, course_full_name, level, program, type,
    start_date, end_date, hours_total, schedule, price, location, online,
    course_book, created_at, updated_at
) VALUES (
    'B1_EVE _FIFE_7', 7, 'B1_EVE _FIFE_7', 'B1 EVE ONLINE - FIFE - 29.09.2025 - R7', 'B1', 'FIFE', 'EVE ONLINE',
    '2025-09-29', '2025-11-05', 24, '{"days": ["M", "W"], "time_range": "19:00-21:00"}', 385.0, 'ONLINE', 1,
    'English File Intermediate 4th Edition (ISBN-13978-0194035910)', NOW(), NOW()
);
INSERT INTO course_offerings (
    attendance_id, round, course_key, course_full_name, level, program, type,
    start_date, end_date, hours_total, schedule, price, location, online,
    course_book, created_at, updated_at
) VALUES (
    'A1_BEGI_EDMON_7', 7, 'A1_BEGI_EDMON_7', 'A1 BEGINNER - EDMONTON - 29.09.2025 - R7', 'A1', 'EDMONTON', 'BEGINNER',
    '2025-09-29', '2025-11-05', 24, '{"days": ["M", "W"], "time_range": "15:30-17:30"}', 445.0, 'MixTree Languages - Eerste Weteringplantsoen 2c - 1017 SJ Amsterdam', 0,
    'English File Beginner Student’s Book - 4th Edition (ISBN-13978-0194029803)', NOW(), NOW()
);
INSERT INTO course_offerings (
    attendance_id, round, course_key, course_full_name, level, program, type,
    start_date, end_date, hours_total, schedule, price, location, online,
    course_book, created_at, updated_at
) VALUES (
    'A2 EL_MORN_EDMON_7', 7, 'A2 EL_MORN_EDMON_7', 'A2 ELEM MORNING - EDMONTON - 29.09.2025 - R7', 'A2 ELEM', 'EDMONTON', 'MORNING',
    '2025-09-29', '2025-11-05', 30, '{"days": ["M", "W"], "time_range": "9:30-12:00"}', 525.0, 'MixTree Languages - Eerste Weteringplantsoen 2c - 1017 SJ Amsterdam', 0,
    'English File Elementary 4th Edition (ISBN-13978-0194031592)', NOW(), NOW()
);
INSERT INTO course_offerings (
    attendance_id, round, course_key, course_full_name, level, program, type,
    start_date, end_date, hours_total, schedule, price, location, online,
    course_book, created_at, updated_at
) VALUES (
    'A2_INTE_BOSTO_10', 10, 'A2_INTE_BOSTO_10', 'A2 INTENSIVE - BOSTON - 29.09.2025 - R10', 'A2', 'BOSTON', 'INTENSIVE',
    '2025-09-29', '2025-10-24', 40, '{"days": ["M", "T", "Th", "F"], "time_range": "15:30-18:00"}', 640.0, 'MixTree Languages - Eerste Weteringplantsoen 2c - 1017 SJ Amsterdam', 0,
    'English File Pre-Intermediate 4th Edition (ISBN-13 978-0194037419)', NOW(), NOW()
);
INSERT INTO course_offerings (
    attendance_id, round, course_key, course_full_name, level, program, type,
    start_date, end_date, hours_total, schedule, price, location, online,
    course_book, created_at, updated_at
) VALUES (
    'B1_INTE_BOSTO_10', 10, 'B1_INTE_BOSTO_10', 'B1 INTENSIVE - BOSTON - 29.09.2025 - R10', 'B1', 'BOSTON', 'INTENSIVE',
    '2025-09-29', '2025-10-24', 40, '{"days": ["M", "T", "Th", "F"], "time_range": "12:30-15:00"}', 640.0, 'MixTree Languages - Eerste Weteringplantsoen 2c - 1017 SJ Amsterdam', 0,
    'English File Intermediate 4th Edition (ISBN-13978-0194035910)', NOW(), NOW()
);
INSERT INTO course_offerings (
    attendance_id, round, course_key, course_full_name, level, program, type,
    start_date, end_date, hours_total, schedule, price, location, online,
    course_book, created_at, updated_at
) VALUES (
    'B2_INTE_BOSTO_10', 10, 'B2_INTE_BOSTO_10', 'B2 INTENSIVE - BOSTON - 29.09.2025 - R10', 'B2', 'BOSTON', 'INTENSIVE',
    '2025-09-29', '2025-10-24', 40, '{"days": ["M", "T", "Th", "F"], "time_range": "12:30-15:00"}', 640.0, 'MixTree Languages - Eerste Weteringplantsoen 2c - 1017 SJ Amsterdam', 0,
    'English File Upper Intermediate 4th Edition (ISBN-978-0194039697)', NOW(), NOW()
);
INSERT INTO course_offerings (
    attendance_id, round, course_key, course_full_name, level, program, type,
    start_date, end_date, hours_total, schedule, price, location, online,
    course_book, created_at, updated_at
) VALUES (
    'C1_MORN_EDMON_7', 7, 'C1_MORN_EDMON_7', 'C1 MORNING - EDMONTON - 30.09.2025 - R7', 'C1', 'EDMONTON', 'MORNING',
    '2025-09-30', '2025-11-07', 30, '{"days": ["T", "F"], "time_range": "9:30-12:00"}', 525.0, 'MixTree Languages - Eerste Weteringplantsoen 2c - 1017 SJ Amsterdam', 0,
    'English File 4th: Advanced (ISBN-13978-0194038355)', NOW(), NOW()
);
INSERT INTO course_offerings (
    attendance_id, round, course_key, course_full_name, level, program, type,
    start_date, end_date, hours_total, schedule, price, location, online,
    course_book, created_at, updated_at
) VALUES (
    'A2 PR_MORN_EDMON_7', 7, 'A2 PR_MORN_EDMON_7', 'A2 PRE-INT MORNING - EDMONTON - 30.09.2025 - R7', 'A2 PRE-INT', 'EDMONTON', 'MORNING',
    '2025-09-30', '2025-11-06', 30, '{"days": ["T", "Th"], "time_range": "9:30-12:00"}', 525.0, 'MixTree Languages - Eerste Weteringplantsoen 2c - 1017 SJ Amsterdam', 0,
    'English File Pre-Intermediate 4th Edition (ISBN-13 978-0194037419)', NOW(), NOW()
);
INSERT INTO course_offerings (
    attendance_id, round, course_key, course_full_name, level, program, type,
    start_date, end_date, hours_total, schedule, price, location, online,
    course_book, created_at, updated_at
) VALUES (
    'A2 PR_MORN_EDMON_7(2)', 1, 'A2 PR_MORN_EDMON_7(2)', 'A2 PRE-INT MORNING - EDMONTON - 30.09.2025 - R7(2)', 'A2 PRE-INT', 'EDMONTON', 'MORNING',
    '2025-09-30', '2025-11-06', 30, '{"days": ["T", "Th"], "time_range": "9:30-12:00"}', 525.0, 'MixTree Languages - Eerste Weteringplantsoen 2c - 1017 SJ Amsterdam', 0,
    'English File Pre-Intermediate 4th Edition (ISBN-13 978-0194037419)', NOW(), NOW()
);
INSERT INTO course_offerings (
    attendance_id, round, course_key, course_full_name, level, program, type,
    start_date, end_date, hours_total, schedule, price, location, online,
    course_book, created_at, updated_at
) VALUES (
    'B2_EVE _EDMON_7', 7, 'B2_EVE _EDMON_7', 'B2 EVE ONLINE - EDMONTON - 06.10.2025 - R7', 'B2', 'EDMONTON', 'EVE ONLINE',
    '2025-10-06', '2025-11-12', 24, '{"days": ["M", "W"], "time_range": "19:00-21:00"}', 385.0, 'ONLINE', 1,
    'English File Upper Intermediate 4th Edition (ISBN-978-0194039697)', NOW(), NOW()
);
INSERT INTO course_offerings (
    attendance_id, round, course_key, course_full_name, level, program, type,
    start_date, end_date, hours_total, schedule, price, location, online,
    course_book, created_at, updated_at
) VALUES (
    'B2_MORN_EDMON_7', 7, 'B2_MORN_EDMON_7', 'B2 MORNING - EDMONTON - 06.10.2025 - R7', 'B2', 'EDMONTON', 'MORNING',
    '2025-10-06', '2025-11-13', 30, '{"days": ["M", "Th"], "time_range": "9:30-12:00"}', 525.0, 'MixTree Languages - Eerste Weteringplantsoen 2c - 1017 SJ Amsterdam', 0,
    'English File Upper Intermediate 4th Edition (ISBN-978-0194039697)', NOW(), NOW()
);
INSERT INTO course_offerings (
    attendance_id, round, course_key, course_full_name, level, program, type,
    start_date, end_date, hours_total, schedule, price, location, online,
    course_book, created_at, updated_at
) VALUES (
    'BUSIN_EVE _EDMON_7', 7, 'BUSIN_EVE _EDMON_7', 'BUSINESS EVE ONLINE - EDMONTON - 07.10.2025 - R7', 'BUSINESS', 'EDMONTON', 'EVE ONLINE',
    '2025-10-07', '2025-11-13', 24, '{"days": ["M", "W"], "time_range": "19:00-21:00"}', 385.0, 'ONLINE', 1,
    'Business Partner B2+ – Pearson Benelux', NOW(), NOW()
);
INSERT INTO course_offerings (
    attendance_id, round, course_key, course_full_name, level, program, type,
    start_date, end_date, hours_total, schedule, price, location, online,
    course_book, created_at, updated_at
) VALUES (
    'C1_EVE _EDMON_7', 7, 'C1_EVE _EDMON_7', 'C1 EVE ONLINE - EDMONTON - 07.10.2025 - R7', 'C1', 'EDMONTON', 'EVE ONLINE',
    '2025-10-07', '2025-11-13', 24, '{"days": ["T", "Th"], "time_range": "19:00-21:00"}', 385.0, 'ONLINE', 1,
    'English File 4th: Advanced (ISBN-13978-0194038355)', NOW(), NOW()
);
INSERT INTO course_offerings (
    attendance_id, round, course_key, course_full_name, level, program, type,
    start_date, end_date, hours_total, schedule, price, location, online,
    course_book, created_at, updated_at
) VALUES (
    'B1_MORN_EDMON_7', 7, 'B1_MORN_EDMON_7', 'B1 MORNING - EDMONTON - 08.10.2025 - R7', 'B1', 'EDMONTON', 'MORNING',
    '2025-10-08', '2025-11-14', 30, '{"days": ["W", "F"], "time_range": "9:30-12:00"}', 525.0, 'MixTree Languages - Eerste Weteringplantsoen 2c - 1017 SJ Amsterdam', 0,
    'English File Intermediate 4th Edition (ISBN-13978-0194035910)', NOW(), NOW()
);
INSERT INTO course_offerings (
    attendance_id, round, course_key, course_full_name, level, program, type,
    start_date, end_date, hours_total, schedule, price, location, online,
    course_book, created_at, updated_at
) VALUES (
    'A2 PR_EVE _EDMON_7', 7, 'A2 PR_EVE _EDMON_7', 'A2 PRE-INT EVE ONLINE - EDMONTON - 21.10.2025 - R7', 'A2 PRE-INT', 'EDMONTON', 'EVE ONLINE',
    '2025-10-21', '2025-11-27', 24, '{"days": ["T", "Th"], "time_range": "19:00-21:00"}', 385.0, 'ONLINE', 1,
    'English File Pre-Intermediate 4th Edition (ISBN-13 978-0194037419)', NOW(), NOW()
);
INSERT INTO course_offerings (
    attendance_id, round, course_key, course_full_name, level, program, type,
    start_date, end_date, hours_total, schedule, price, location, online,
    course_book, created_at, updated_at
) VALUES (
    'A2_INTE_CAPE _11', 11, 'A2_INTE_CAPE _11', 'A2 INTENSIVE - CAPE TOWN - 27.10.2025 - R11', 'A2', 'CAPE TOWN', 'INTENSIVE',
    '2025-10-27', '2025-11-21', 40, '{"days": ["M", "T", "Th", "F"], "time_range": "12:30-15:00"}', 640.0, 'MixTree Languages - Eerste Weteringplantsoen 2c - 1017 SJ Amsterdam', 0,
    'English File Pre-Intermediate 4th Edition (ISBN-13 978-0194037419)', NOW(), NOW()
);
INSERT INTO course_offerings (
    attendance_id, round, course_key, course_full_name, level, program, type,
    start_date, end_date, hours_total, schedule, price, location, online,
    course_book, created_at, updated_at
) VALUES (
    'B1_INTE_CAPE _11', 11, 'B1_INTE_CAPE _11', 'B1 INTENSIVE - CAPE TOWN - 27.10.2025 - R11', 'B1', 'CAPE TOWN', 'INTENSIVE',
    '2025-10-27', '2025-11-21', 40, '{"days": ["M", "T", "Th", "F"], "time_range": "15:30-18:00"}', 640.0, 'MixTree Languages - Eerste Weteringplantsoen 2c - 1017 SJ Amsterdam', 0,
    'English File Intermediate 4th Edition (ISBN-13978-0194035910)', NOW(), NOW()
);
INSERT INTO course_offerings (
    attendance_id, round, course_key, course_full_name, level, program, type,
    start_date, end_date, hours_total, schedule, price, location, online,
    course_book, created_at, updated_at
) VALUES (
    'B2_INTE_CAPE _11', 11, 'B2_INTE_CAPE _11', 'B2 INTENSIVE - CAPE TOWN - 27.10.2025 - R11', 'B2', 'CAPE TOWN', 'INTENSIVE',
    '2025-10-27', '2025-11-21', 40, '{"days": ["M", "T", "Th", "F"], "time_range": "12:30-15:00"}', 640.0, 'MixTree Languages - Eerste Weteringplantsoen 2c - 1017 SJ Amsterdam', 0,
    'English File Upper Intermediate 4th Edition (ISBN-978-0194039697)', NOW(), NOW()
);
INSERT INTO course_offerings (
    attendance_id, round, course_key, course_full_name, level, program, type,
    start_date, end_date, hours_total, schedule, price, location, online,
    course_book, created_at, updated_at
) VALUES (
    'B1_EVE _FIFE_8', 8, 'B1_EVE _FIFE_8', 'B1 EVE ONLINE - FIFE - 10.11.2025 - R8', 'B1', 'FIFE', 'EVE ONLINE',
    '2025-11-10', '2025-12-17', 24, '{"days": ["M", "W"], "time_range": "19:00-21:00"}', 385.0, 'ONLINE', 1,
    'English File Intermediate 4th Edition (ISBN-13978-0194035910)', NOW(), NOW()
);
INSERT INTO course_offerings (
    attendance_id, round, course_key, course_full_name, level, program, type,
    start_date, end_date, hours_total, schedule, price, location, online,
    course_book, created_at, updated_at
) VALUES (
    'A1_BEGI_DUBLI_8', 8, 'A1_BEGI_DUBLI_8', 'A1 BEGINNER - DUBLIN - 10.11.2025 - R8', 'A1', 'DUBLIN', 'BEGINNER',
    '2025-11-10', '2025-12-17', 24, '{"days": ["M", "W"], "time_range": "15:30-17:30"}', 445.0, 'MixTree Languages - Eerste Weteringplantsoen 2c - 1017 SJ Amsterdam', 0,
    'English File Beginner Student’s Book - 4th Edition (ISBN-13978-0194029803)', NOW(), NOW()
);
INSERT INTO course_offerings (
    attendance_id, round, course_key, course_full_name, level, program, type,
    start_date, end_date, hours_total, schedule, price, location, online,
    course_book, created_at, updated_at
) VALUES (
    'A2 EL_MORN_FIFE_8', 8, 'A2 EL_MORN_FIFE_8', 'A2 ELEM MORNING - FIFE - 10.11.2025 - R8', 'A2 ELEM', 'FIFE', 'MORNING',
    '2025-11-10', '2025-12-17', 30, '{"days": ["M", "W"], "time_range": "9:30-12:00"}', 525.0, 'MixTree Languages - Eerste Weteringplantsoen 2c - 1017 SJ Amsterdam', 0,
    'English File Elementary 4th Edition (ISBN-13978-0194031592)', NOW(), NOW()
);
INSERT INTO course_offerings (
    attendance_id, round, course_key, course_full_name, level, program, type,
    start_date, end_date, hours_total, schedule, price, location, online,
    course_book, created_at, updated_at
) VALUES (
    'A2 EL_MORN_FIFE_8-2', 8, 'A2 EL_MORN_FIFE_8-2', 'A2 ELEM MORNING - FIFE - 10.11.2025 - R8-2', 'A2 ELEM', 'FIFE', 'MORNING',
    '2025-11-10', '2025-12-17', 30, '{"days": ["M", "W"], "time_range": "15:30-18:00"}', 525.0, 'MixTree Languages - Eerste Weteringplantsoen 2c - 1017 SJ Amsterdam', 0,
    'English File Elementary 4th Edition (ISBN-13978-0194031592)', NOW(), NOW()
);
INSERT INTO course_offerings (
    attendance_id, round, course_key, course_full_name, level, program, type,
    start_date, end_date, hours_total, schedule, price, location, online,
    course_book, created_at, updated_at
) VALUES (
    'A2 PR_MORN_FIFE_8-2', 8, 'A2 PR_MORN_FIFE_8-2', 'A2 PRE-INT MORNING - FIFE - 11.11.2025 - R8-2', 'A2 PRE-INT', 'FIFE', 'MORNING',
    '2025-11-11', '2025-12-18', 30, '{"days": ["T", "F"], "time_range": "9:30-12:00"}', 525.0, 'MixTree Languages - Eerste Weteringplantsoen 2c - 1017 SJ Amsterdam', 0,
    'English File Pre-Intermediate 4th Edition (ISBN-13 978-0194037419)', NOW(), NOW()
);
INSERT INTO course_offerings (
    attendance_id, round, course_key, course_full_name, level, program, type,
    start_date, end_date, hours_total, schedule, price, location, online,
    course_book, created_at, updated_at
) VALUES (
    'C1_MORN_FIFE_8', 8, 'C1_MORN_FIFE_8', 'C1 MORNING - FIFE - 11.11.2025 - R8', 'C1', 'FIFE', 'MORNING',
    '2025-11-11', '2025-12-19', 30, '{"days": ["T", "F"], "time_range": "9:30-12:00"}', 525.0, 'MixTree Languages - Eerste Weteringplantsoen 2c - 1017 SJ Amsterdam', 0,
    'English File 4th: Advanced (ISBN-13978-0194038355)', NOW(), NOW()
);
INSERT INTO course_offerings (
    attendance_id, round, course_key, course_full_name, level, program, type,
    start_date, end_date, hours_total, schedule, price, location, online,
    course_book, created_at, updated_at
) VALUES (
    'A2 PR_MORN_FIFE_8', 8, 'A2 PR_MORN_FIFE_8', 'A2 PRE-INT MORNING - FIFE - 11.11.2025 - R8', 'A2 PRE-INT', 'FIFE', 'MORNING',
    '2025-11-11', '2025-12-18', 30, '{"days": ["T", "Th"], "time_range": "9:30-12:00"}', 525.0, 'MixTree Languages - Eerste Weteringplantsoen 2c - 1017 SJ Amsterdam', 0,
    'English File Pre-Intermediate 4th Edition (ISBN-13 978-0194037419)', NOW(), NOW()
);
INSERT INTO course_offerings (
    attendance_id, round, course_key, course_full_name, level, program, type,
    start_date, end_date, hours_total, schedule, price, location, online,
    course_book, created_at, updated_at
) VALUES (
    'B2_EVE _FIFE_8', 8, 'B2_EVE _FIFE_8', 'B2 EVE ONLINE - FIFE - 17.11.2025 - R8', 'B2', 'FIFE', 'EVE ONLINE',
    '2025-11-17', '2025-12-24', 24, '{"days": ["M", "W"], "time_range": "19:00-21:00"}', 385.0, 'ONLINE', 1,
    'English File Upper Intermediate 4th Edition (ISBN-978-0194039697)', NOW(), NOW()
);
INSERT INTO course_offerings (
    attendance_id, round, course_key, course_full_name, level, program, type,
    start_date, end_date, hours_total, schedule, price, location, online,
    course_book, created_at, updated_at
) VALUES (
    'B2_MORN_FIFE_8', 8, 'B2_MORN_FIFE_8', 'B2 MORNING - FIFE - 17.11.2025 - R8', 'B2', 'FIFE', 'MORNING',
    '2025-11-17', '2025-12-18', 25, '{"days": ["M", "Th"], "time_range": "9:30-12:00"}', 450.0, 'MixTree Languages - Eerste Weteringplantsoen 2c - 1017 SJ Amsterdam', 0,
    'English File Upper Intermediate 4th Edition (ISBN-978-0194039697)', NOW(), NOW()
);
INSERT INTO course_offerings (
    attendance_id, round, course_key, course_full_name, level, program, type,
    start_date, end_date, hours_total, schedule, price, location, online,
    course_book, created_at, updated_at
) VALUES (
    'BUSIN_EVE _FIFE_8', 8, 'BUSIN_EVE _FIFE_8', 'BUSINESS EVE ONLINE - FIFE - 18.11.2025 - R8', 'BUSINESS', 'FIFE', 'EVE ONLINE',
    '2025-11-18', '2025-12-19', 20, '{"days": ["T", "F"], "time_range": "19:00-21:00"}', 335.0, 'ONLINE', 1,
    'Business Partner B2+ – Pearson Benelux', NOW(), NOW()
);
INSERT INTO course_offerings (
    attendance_id, round, course_key, course_full_name, level, program, type,
    start_date, end_date, hours_total, schedule, price, location, online,
    course_book, created_at, updated_at
) VALUES (
    'C1_EVE _FIFE_8', 8, 'C1_EVE _FIFE_8', 'C1 EVE ONLINE - FIFE - 18.11.2025 - R8', 'C1', 'FIFE', 'EVE ONLINE',
    '2025-11-18', '2025-12-18', 20, '{"days": ["T", "Th"], "time_range": "19:00-21:00"}', 335.0, 'ONLINE', 1,
    'English File 4th: Advanced (ISBN-13978-0194038355)', NOW(), NOW()
);
INSERT INTO course_offerings (
    attendance_id, round, course_key, course_full_name, level, program, type,
    start_date, end_date, hours_total, schedule, price, location, online,
    course_book, created_at, updated_at
) VALUES (
    'B1_MORN_FIFE_8', 8, 'B1_MORN_FIFE_8', 'B1 MORNING - FIFE - 19.11.2025 - R8', 'B1', 'FIFE', 'MORNING',
    '2025-11-19', '2025-12-19', 25, '{"days": ["W", "F"], "time_range": "9:30-12:00"}', 450.0, 'MixTree Languages - Eerste Weteringplantsoen 2c - 1017 SJ Amsterdam', 0,
    'English File Intermediate 4th Edition (ISBN-13978-0194035910)', NOW(), NOW()
);
INSERT INTO course_offerings (
    attendance_id, round, course_key, course_full_name, level, program, type,
    start_date, end_date, hours_total, schedule, price, location, online,
    course_book, created_at, updated_at
) VALUES (
    'A2_INTE_AUCKL_12', 12, 'A2_INTE_AUCKL_12', 'A2 INTENSIVE - AUCKLAND - 24.11.2025 - R12', 'A2', 'AUCKLAND', 'INTENSIVE',
    '2025-11-24', '2025-12-19', 40, '{"days": ["M", "T", "Th", "F"], "time_range": "12:30-15:00"}', 640.0, 'MixTree Languages - Eerste Weteringplantsoen 2c - 1017 SJ Amsterdam', 0,
    'English File Pre-Intermediate 4th Edition (ISBN-13 978-0194037419)', NOW(), NOW()
);
INSERT INTO course_offerings (
    attendance_id, round, course_key, course_full_name, level, program, type,
    start_date, end_date, hours_total, schedule, price, location, online,
    course_book, created_at, updated_at
) VALUES (
    'B1_INTE_AUCKL_12', 12, 'B1_INTE_AUCKL_12', 'B1 INTENSIVE - AUCKLAND - 24.11.2025 - R12', 'B1', 'AUCKLAND', 'INTENSIVE',
    '2025-11-24', '2025-12-19', 40, '{"days": ["M", "T", "Th", "F"], "time_range": "12:30-15:00"}', 640.0, 'MixTree Languages - Eerste Weteringplantsoen 2c - 1017 SJ Amsterdam', 0,
    'English File Intermediate 4th Edition (ISBN-13978-0194035910)', NOW(), NOW()
);
INSERT INTO course_offerings (
    attendance_id, round, course_key, course_full_name, level, program, type,
    start_date, end_date, hours_total, schedule, price, location, online,
    course_book, created_at, updated_at
) VALUES (
    'B2_INTE_AUCKL_12', 12, 'B2_INTE_AUCKL_12', 'B2 INTENSIVE - AUCKLAND - 24.11.2025 - R12', 'B2', 'AUCKLAND', 'INTENSIVE',
    '2025-11-24', '2025-12-19', 40, '{"days": ["M", "T", "Th", "F"], "time_range": "15:30-18:00"}', 640.0, 'MixTree Languages - Eerste Weteringplantsoen 2c - 1017 SJ Amsterdam', 0,
    'English File Upper Intermediate 4th Edition (ISBN-978-0194039697)', NOW(), NOW()
);
INSERT INTO course_offerings (
    attendance_id, round, course_key, course_full_name, level, program, type,
    start_date, end_date, hours_total, schedule, price, location, online,
    course_book, created_at, updated_at
) VALUES (
    'A2_INTE_BOSTO_1', 1, 'A2_INTE_BOSTO_1', 'A2 INTENSIVE - BOSTON - 12.01.2026 - R1', 'A2', 'BOSTON', 'INTENSIVE',
    '2026-01-12', '2026-02-06', 40, '{"days": ["M", "T", "Th", "F"], "time_range": "15:30-18:00"}', 640.0, 'MixTree Languages - Eerste Weteringplantsoen 2c - 1017 SJ Amsterdam', 0,
    'English File Pre-Intermediate 4th Edition (ISBN-13 978-0194037419)', NOW(), NOW()
);
INSERT INTO course_offerings (
    attendance_id, round, course_key, course_full_name, level, program, type,
    start_date, end_date, hours_total, schedule, price, location, online,
    course_book, created_at, updated_at
) VALUES (
    'B1_INTE_BOSTO_1', 1, 'B1_INTE_BOSTO_1', 'B1 INTENSIVE - BOSTON - 12.01.2026 - R1', 'B1', 'BOSTON', 'INTENSIVE',
    '2026-01-12', '2026-02-06', 40, '{"days": ["M", "T", "Th", "F"], "time_range": "12:30-15:00"}', 640.0, 'MixTree Languages - Eerste Weteringplantsoen 2c - 1017 SJ Amsterdam', 0,
    'English File Intermediate 4th Edition (ISBN-13978-0194035910)', NOW(), NOW()
);
INSERT INTO course_offerings (
    attendance_id, round, course_key, course_full_name, level, program, type,
    start_date, end_date, hours_total, schedule, price, location, online,
    course_book, created_at, updated_at
) VALUES (
    'B2_INTE_BOSTO_1', 1, 'B2_INTE_BOSTO_1', 'B2 INTENSIVE - BOSTON - 12.01.2026 - R1', 'B2', 'BOSTON', 'INTENSIVE',
    '2026-01-12', '2026-02-06', 40, '{"days": ["M", "T", "Th", "F"], "time_range": "12:30-15:00"}', 640.0, 'MixTree Languages - Eerste Weteringplantsoen 2c - 1017 SJ Amsterdam', 0,
    'English File Upper Intermediate 4th Edition (ISBN-978-0194039697)', NOW(), NOW()
);
INSERT INTO course_offerings (
    attendance_id, round, course_key, course_full_name, level, program, type,
    start_date, end_date, hours_total, schedule, price, location, online,
    course_book, created_at, updated_at
) VALUES (
    'B2_MORN_DUBLI_1', 1, 'B2_MORN_DUBLI_1', 'B2 MORNING - DUBLIN - 12.01.2026 - R1', 'B2', 'DUBLIN', 'MORNING',
    '2026-01-12', '2026-02-19', 30, '{"days": ["M", "Th"], "time_range": "9:30-12:00"}', 525.0, 'MixTree Languages - Eerste Weteringplantsoen 2c - 1017 SJ Amsterdam', 0,
    'English File Upper Intermediate 4th Edition (ISBN-978-0194039697)', NOW(), NOW()
);
INSERT INTO course_offerings (
    attendance_id, round, course_key, course_full_name, level, program, type,
    start_date, end_date, hours_total, schedule, price, location, online,
    course_book, created_at, updated_at
) VALUES (
    'A1_BEGI_EDMON_1', 1, 'A1_BEGI_EDMON_1', 'A1 BEGINNER - EDMONTON - 12.01.2026 - R1', 'A1', 'EDMONTON', 'BEGINNER',
    '2026-01-12', '2026-02-18', 24, '{"days": ["M", "W"], "time_range": "15:30-17:30"}', 445.0, 'MixTree Languages - Eerste Weteringplantsoen 2c - 1017 SJ Amsterdam', 0,
    'English File Beginner 4th Edition (ISBN-13 978-0194031608)', NOW(), NOW()
);
INSERT INTO course_offerings (
    attendance_id, round, course_key, course_full_name, level, program, type,
    start_date, end_date, hours_total, schedule, price, location, online,
    course_book, created_at, updated_at
) VALUES (
    'A2 EL_MORN_DUBLI_1', 1, 'A2 EL_MORN_DUBLI_1', 'A2 ELEM MORNING - DUBLIN - 12.01.2026 - R1', 'A2 ELEM', 'DUBLIN', 'MORNING',
    '2026-01-12', '2026-02-18', 30, '{"days": ["M", "W"], "time_range": "9:30-12:00"}', 525.0, 'MixTree Languages - Eerste Weteringplantsoen 2c - 1017 SJ Amsterdam', 0,
    'English File Elementary Plus 4th Edition (ISBN-13 978-0194032414)', NOW(), NOW()
);
INSERT INTO course_offerings (
    attendance_id, round, course_key, course_full_name, level, program, type,
    start_date, end_date, hours_total, schedule, price, location, online,
    course_book, created_at, updated_at
) VALUES (
    'B1_EVE _DUBLI_1', 1, 'B1_EVE _DUBLI_1', 'B1 EVE ONLINE - DUBLIN - 12.01.2026 - R1', 'B1', 'DUBLIN', 'EVE ONLINE',
    '2026-01-12', '2026-02-18', 24, '{"days": ["M", "W"], "time_range": "19:00-21:00"}', 385.0, 'ONLINE', 1,
    'English File Intermediate 4th Edition (ISBN-13978-0194035910)', NOW(), NOW()
);
INSERT INTO course_offerings (
    attendance_id, round, course_key, course_full_name, level, program, type,
    start_date, end_date, hours_total, schedule, price, location, online,
    course_book, created_at, updated_at
) VALUES (
    'B2_EVE _DUBLI_1', 1, 'B2_EVE _DUBLI_1', 'B2 EVE ONLINE - DUBLIN - 12.01.2026 - R1', 'B2', 'DUBLIN', 'EVE ONLINE',
    '2026-01-12', '2026-02-18', 24, '{"days": ["M", "W"], "time_range": "19:00-21:00"}', 385.0, 'ONLINE', 1,
    'English File Upper Intermediate 4th Edition (ISBN-978-0194039697)', NOW(), NOW()
);
INSERT INTO course_offerings (
    attendance_id, round, course_key, course_full_name, level, program, type,
    start_date, end_date, hours_total, schedule, price, location, online,
    course_book, created_at, updated_at
) VALUES (
    'BUSIN_EVE _DUBLI_1', 1, 'BUSIN_EVE _DUBLI_1', 'BUSINESS EVE ONLINE - DUBLIN - 12.01.2026 - R1', 'BUSINESS', 'DUBLIN', 'EVE ONLINE',
    '2026-01-12', '2026-02-18', 24, '{"days": ["M", "W"], "time_range": "19:00-21:00"}', 385.0, 'ONLINE', 1,
    'Business Result Pre-Intermediate 2nd Edition (ISBN-13 978-0194739542)', NOW(), NOW()
);
INSERT INTO course_offerings (
    attendance_id, round, course_key, course_full_name, level, program, type,
    start_date, end_date, hours_total, schedule, price, location, online,
    course_book, created_at, updated_at
) VALUES (
    'C1_MORN_DUBLI_1', 1, 'C1_MORN_DUBLI_1', 'C1 MORNING - DUBLIN - 13.01.2026 - R1', 'C1', 'DUBLIN', 'MORNING',
    '2026-01-13', '2026-02-20', 30, '{"days": ["T", "F"], "time_range": "9:30-12:00"}', 525.0, 'MixTree Languages - Eerste Weteringplantsoen 2c - 1017 SJ Amsterdam', 0,
    'English File Advanced 4th Edition (ISBN-13 978-0194031691)', NOW(), NOW()
);
INSERT INTO course_offerings (
    attendance_id, round, course_key, course_full_name, level, program, type,
    start_date, end_date, hours_total, schedule, price, location, online,
    course_book, created_at, updated_at
) VALUES (
    'A2 PR_EVE _DUBLI_1', 1, 'A2 PR_EVE _DUBLI_1', 'A2 PRE-INT EVE ONLINE - DUBLIN - 13.01.2026 - R1', 'A2 PRE-INT', 'DUBLIN', 'EVE ONLINE',
    '2026-01-13', '2026-02-19', 24, '{"days": ["T", "Th"], "time_range": "19:00-21:00"}', 385.0, 'ONLINE', 1,
    'English File Pre-Intermediate 4th Edition (ISBN-13 978-0194037419)', NOW(), NOW()
);
INSERT INTO course_offerings (
    attendance_id, round, course_key, course_full_name, level, program, type,
    start_date, end_date, hours_total, schedule, price, location, online,
    course_book, created_at, updated_at
) VALUES (
    'A2 PR_MORN_DUBLI_1', 1, 'A2 PR_MORN_DUBLI_1', 'A2 PRE-INT MORNING - DUBLIN - 13.01.2026 - R1', 'A2 PRE-INT', 'DUBLIN', 'MORNING',
    '2026-01-13', '2026-02-19', 30, '{"days": ["T", "Th"], "time_range": "9:30-12:00"}', 525.0, 'MixTree Languages - Eerste Weteringplantsoen 2c - 1017 SJ Amsterdam', 0,
    'English File Pre-Intermediate 4th Edition (ISBN-13 978-0194037419)', NOW(), NOW()
);
INSERT INTO course_offerings (
    attendance_id, round, course_key, course_full_name, level, program, type,
    start_date, end_date, hours_total, schedule, price, location, online,
    course_book, created_at, updated_at
) VALUES (
    'C1_EVE _DUBLI_1', 1, 'C1_EVE _DUBLI_1', 'C1 EVE ONLINE - DUBLIN - 13.01.2026 - R1', 'C1', 'DUBLIN', 'EVE ONLINE',
    '2026-01-13', '2026-02-19', 24, '{"days": ["T", "Th"], "time_range": "19:00-21:00"}', 385.0, 'ONLINE', 1,
    'English File Advanced 4th Edition (ISBN-13 978-0194031691)', NOW(), NOW()
);
INSERT INTO course_offerings (
    attendance_id, round, course_key, course_full_name, level, program, type,
    start_date, end_date, hours_total, schedule, price, location, online,
    course_book, created_at, updated_at
) VALUES (
    'B1_MORN_DUBLI_1', 1, 'B1_MORN_DUBLI_1', 'B1 MORNING - DUBLIN - 14.01.2026 - R1', 'B1', 'DUBLIN', 'MORNING',
    '2026-01-14', '2026-02-20', 30, '{"days": ["W", "F"], "time_range": "9:30-12:00"}', 525.0, 'MixTree Languages - Eerste Weteringplantsoen 2c - 1017 SJ Amsterdam', 0,
    'English File Intermediate 4th Edition (ISBN-13978-0194035910)', NOW(), NOW()
);
INSERT INTO course_offerings (
    attendance_id, round, course_key, course_full_name, level, program, type,
    start_date, end_date, hours_total, schedule, price, location, online,
    course_book, created_at, updated_at
) VALUES (
    'A2_INTE_CAPE _2', 2, 'A2_INTE_CAPE _2', 'A2 INTENSIVE - CAPE TOWN - 09.02.2026 - R2', 'A2', 'CAPE TOWN', 'INTENSIVE',
    '2026-02-09', '2026-03-06', 40, '{"days": ["M", "T", "Th", "F"], "time_range": "12:30-15:00"}', 640.0, 'MixTree Languages - Eerste Weteringplantsoen 2c - 1017 SJ Amsterdam', 0,
    'English File Pre-Intermediate 4th Edition (ISBN-13 978-0194037419)', NOW(), NOW()
);
INSERT INTO course_offerings (
    attendance_id, round, course_key, course_full_name, level, program, type,
    start_date, end_date, hours_total, schedule, price, location, online,
    course_book, created_at, updated_at
) VALUES (
    'B1_INTE_CAPE _2', 2, 'B1_INTE_CAPE _2', 'B1 INTENSIVE - CAPE TOWN - 09.02.2026 - R2', 'B1', 'CAPE TOWN', 'INTENSIVE',
    '2026-02-09', '2026-03-06', 40, '{"days": ["M", "T", "Th", "F"], "time_range": "15:30-18:00"}', 640.0, 'MixTree Languages - Eerste Weteringplantsoen 2c - 1017 SJ Amsterdam', 0,
    'English File Intermediate 4th Edition (ISBN-13978-0194035910)', NOW(), NOW()
);
INSERT INTO course_offerings (
    attendance_id, round, course_key, course_full_name, level, program, type,
    start_date, end_date, hours_total, schedule, price, location, online,
    course_book, created_at, updated_at
) VALUES (
    'B2_INTE_CAPE _2', 2, 'B2_INTE_CAPE _2', 'B2 INTENSIVE - CAPE TOWN - 09.02.2026 - R2', 'B2', 'CAPE TOWN', 'INTENSIVE',
    '2026-02-09', '2026-03-06', 40, '{"days": ["M", "T", "Th", "F"], "time_range": "12:30-15:00"}', 640.0, 'MixTree Languages - Eerste Weteringplantsoen 2c - 1017 SJ Amsterdam', 0,
    'English File Upper Intermediate 4th Edition (ISBN-978-0194039697)', NOW(), NOW()
);
INSERT INTO course_offerings (
    attendance_id, round, course_key, course_full_name, level, program, type,
    start_date, end_date, hours_total, schedule, price, location, online,
    course_book, created_at, updated_at
) VALUES (
    'B2_MORN_EDMON_2', 2, 'B2_MORN_EDMON_2', 'B2 MORNING - EDMONTON - 23.02.2026 - R2', 'B2', 'EDMONTON', 'MORNING',
    '2026-02-23', '2026-04-02', 30, '{"days": ["M", "Th"], "time_range": "9:30-12:00"}', 525.0, 'MixTree Languages - Eerste Weteringplantsoen 2c - 1017 SJ Amsterdam', 0,
    'English File Upper Intermediate 4th Edition (ISBN-978-0194039697)', NOW(), NOW()
);
INSERT INTO course_offerings (
    attendance_id, round, course_key, course_full_name, level, program, type,
    start_date, end_date, hours_total, schedule, price, location, online,
    course_book, created_at, updated_at
) VALUES (
    'A1_BEGI_DUBLI_2', 2, 'A1_BEGI_DUBLI_2', 'A1 BEGINNER - DUBLIN - 23.02.2026 - R2', 'A1', 'DUBLIN', 'BEGINNER',
    '2026-02-23', '2026-04-01', 24, '{"days": ["M", "W"], "time_range": "15:30-17:30"}', 445.0, 'MixTree Languages - Eerste Weteringplantsoen 2c - 1017 SJ Amsterdam', 0,
    'English File Beginner 4th Edition (ISBN-13 978-0194031608)', NOW(), NOW()
);
INSERT INTO course_offerings (
    attendance_id, round, course_key, course_full_name, level, program, type,
    start_date, end_date, hours_total, schedule, price, location, online,
    course_book, created_at, updated_at
) VALUES (
    'A2 EL_MORN_EDMON_2', 2, 'A2 EL_MORN_EDMON_2', 'A2 ELEM MORNING - EDMONTON - 23.02.2026 - R2', 'A2 ELEM', 'EDMONTON', 'MORNING',
    '2026-02-23', '2026-04-01', 30, '{"days": ["M", "W"], "time_range": "9:30-12:00"}', 525.0, 'MixTree Languages - Eerste Weteringplantsoen 2c - 1017 SJ Amsterdam', 0,
    'English File Elementary Plus 4th Edition (ISBN-13 978-0194032414)', NOW(), NOW()
);
INSERT INTO course_offerings (
    attendance_id, round, course_key, course_full_name, level, program, type,
    start_date, end_date, hours_total, schedule, price, location, online,
    course_book, created_at, updated_at
) VALUES (
    'B1_EVE _EDMON_2', 2, 'B1_EVE _EDMON_2', 'B1 EVE ONLINE - EDMONTON - 23.02.2026 - R2', 'B1', 'EDMONTON', 'EVE ONLINE',
    '2026-02-23', '2026-04-01', 24, '{"days": ["M", "W"], "time_range": "19:00-21:00"}', 385.0, 'ONLINE', 1,
    'English File Intermediate 4th Edition (ISBN-13978-0194035910)', NOW(), NOW()
);
INSERT INTO course_offerings (
    attendance_id, round, course_key, course_full_name, level, program, type,
    start_date, end_date, hours_total, schedule, price, location, online,
    course_book, created_at, updated_at
) VALUES (
    'B2_EVE _EDMON_2', 2, 'B2_EVE _EDMON_2', 'B2 EVE ONLINE - EDMONTON - 23.02.2026 - R2', 'B2', 'EDMONTON', 'EVE ONLINE',
    '2026-02-23', '2026-04-01', 24, '{"days": ["M", "W"], "time_range": "19:00-21:00"}', 385.0, 'ONLINE', 1,
    'English File Upper Intermediate 4th Edition (ISBN-978-0194039697)', NOW(), NOW()
);
INSERT INTO course_offerings (
    attendance_id, round, course_key, course_full_name, level, program, type,
    start_date, end_date, hours_total, schedule, price, location, online,
    course_book, created_at, updated_at
) VALUES (
    'BUSIN_EVE _EDMON_2', 2, 'BUSIN_EVE _EDMON_2', 'BUSINESS EVE ONLINE - EDMONTON - 23.02.2026 - R2', 'BUSINESS', 'EDMONTON', 'EVE ONLINE',
    '2026-02-23', '2026-04-01', 24, '{"days": ["M", "W"], "time_range": "19:00-21:00"}', 385.0, 'ONLINE', 1,
    'Business Result Pre-Intermediate 2nd Edition (ISBN-13 978-0194739542)', NOW(), NOW()
);
INSERT INTO course_offerings (
    attendance_id, round, course_key, course_full_name, level, program, type,
    start_date, end_date, hours_total, schedule, price, location, online,
    course_book, created_at, updated_at
) VALUES (
    'C1_MORN_EDMON_2', 2, 'C1_MORN_EDMON_2', 'C1 MORNING - EDMONTON - 24.02.2026 - R2', 'C1', 'EDMONTON', 'MORNING',
    '2026-02-24', '2026-04-03', 30, '{"days": ["T", "F"], "time_range": "9:30-12:00"}', 525.0, 'MixTree Languages - Eerste Weteringplantsoen 2c - 1017 SJ Amsterdam', 0,
    'English File Advanced 4th Edition (ISBN-13 978-0194031691)', NOW(), NOW()
);
INSERT INTO course_offerings (
    attendance_id, round, course_key, course_full_name, level, program, type,
    start_date, end_date, hours_total, schedule, price, location, online,
    course_book, created_at, updated_at
) VALUES (
    'A2 PR_EVE _EDMON_2', 2, 'A2 PR_EVE _EDMON_2', 'A2 PRE-INT EVE ONLINE - EDMONTON - 24.02.2026 - R2', 'A2 PRE-INT', 'EDMONTON', 'EVE ONLINE',
    '2026-02-24', '2026-04-02', 24, '{"days": ["T", "Th"], "time_range": "19:00-21:00"}', 385.0, 'ONLINE', 1,
    'English File Pre-Intermediate 4th Edition (ISBN-13 978-0194037419)', NOW(), NOW()
);
INSERT INTO course_offerings (
    attendance_id, round, course_key, course_full_name, level, program, type,
    start_date, end_date, hours_total, schedule, price, location, online,
    course_book, created_at, updated_at
) VALUES (
    'A2 PR_MORN_EDMON_2', 2, 'A2 PR_MORN_EDMON_2', 'A2 PRE-INT MORNING - EDMONTON - 24.02.2026 - R2', 'A2 PRE-INT', 'EDMONTON', 'MORNING',
    '2026-02-24', '2026-04-02', 30, '{"days": ["T", "Th"], "time_range": "9:30-12:00"}', 525.0, 'MixTree Languages - Eerste Weteringplantsoen 2c - 1017 SJ Amsterdam', 0,
    'English File Pre-Intermediate 4th Edition (ISBN-13 978-0194037419)', NOW(), NOW()
);
INSERT INTO course_offerings (
    attendance_id, round, course_key, course_full_name, level, program, type,
    start_date, end_date, hours_total, schedule, price, location, online,
    course_book, created_at, updated_at
) VALUES (
    'C1_EVE _EDMON_2', 2, 'C1_EVE _EDMON_2', 'C1 EVE ONLINE - EDMONTON - 24.02.2026 - R2', 'C1', 'EDMONTON', 'EVE ONLINE',
    '2026-02-24', '2026-04-02', 24, '{"days": ["T", "Th"], "time_range": "19:00-21:00"}', 385.0, 'ONLINE', 1,
    'English File Advanced 4th Edition (ISBN-13 978-0194031691)', NOW(), NOW()
);
INSERT INTO course_offerings (
    attendance_id, round, course_key, course_full_name, level, program, type,
    start_date, end_date, hours_total, schedule, price, location, online,
    course_book, created_at, updated_at
) VALUES (
    'B1_MORN_EDMON_2', 2, 'B1_MORN_EDMON_2', 'B1 MORNING - EDMONTON - 25.02.2026 - R2', 'B1', 'EDMONTON', 'MORNING',
    '2026-02-25', '2026-04-03', 30, '{"days": ["W", "F"], "time_range": "9:30-12:00"}', 525.0, 'MixTree Languages - Eerste Weteringplantsoen 2c - 1017 SJ Amsterdam', 0,
    'English File Intermediate 4th Edition (ISBN-13978-0194035910)', NOW(), NOW()
);
INSERT INTO course_offerings (
    attendance_id, round, course_key, course_full_name, level, program, type,
    start_date, end_date, hours_total, schedule, price, location, online,
    course_book, created_at, updated_at
) VALUES (
    'A2_INTE_AUCKL_3', 3, 'A2_INTE_AUCKL_3', 'A2 INTENSIVE - AUCKLAND - 09.03.2026 - R3', 'A2', 'AUCKLAND', 'INTENSIVE',
    '2026-03-09', '2026-04-03', 40, '{"days": ["M", "T", "Th", "F"], "time_range": "12:30-15:00"}', 640.0, 'MixTree Languages - Eerste Weteringplantsoen 2c - 1017 SJ Amsterdam', 0,
    'English File Pre-Intermediate 4th Edition (ISBN-13 978-0194037419)', NOW(), NOW()
);
INSERT INTO course_offerings (
    attendance_id, round, course_key, course_full_name, level, program, type,
    start_date, end_date, hours_total, schedule, price, location, online,
    course_book, created_at, updated_at
) VALUES (
    'B1_INTE_AUCKL_3', 3, 'B1_INTE_AUCKL_3', 'B1 INTENSIVE - AUCKLAND - 09.03.2026 - R3', 'B1', 'AUCKLAND', 'INTENSIVE',
    '2026-03-09', '2026-04-03', 40, '{"days": ["M", "T", "Th", "F"], "time_range": "12:30-15:00"}', 640.0, 'MixTree Languages - Eerste Weteringplantsoen 2c - 1017 SJ Amsterdam', 0,
    'English File Intermediate 4th Edition (ISBN-13978-0194035910)', NOW(), NOW()
);
INSERT INTO course_offerings (
    attendance_id, round, course_key, course_full_name, level, program, type,
    start_date, end_date, hours_total, schedule, price, location, online,
    course_book, created_at, updated_at
) VALUES (
    'B2_INTE_AUCKL_3', 3, 'B2_INTE_AUCKL_3', 'B2 INTENSIVE - AUCKLAND - 09.03.2026 - R3', 'B2', 'AUCKLAND', 'INTENSIVE',
    '2026-03-09', '2026-04-03', 40, '{"days": ["M", "T", "Th", "F"], "time_range": "15:30-18:00"}', 640.0, 'MixTree Languages - Eerste Weteringplantsoen 2c - 1017 SJ Amsterdam', 0,
    'English File Upper Intermediate 4th Edition (ISBN-978-0194039697)', NOW(), NOW()
);
INSERT INTO course_offerings (
    attendance_id, round, course_key, course_full_name, level, program, type,
    start_date, end_date, hours_total, schedule, price, location, online,
    course_book, created_at, updated_at
) VALUES (
    'A2_INTE_BOSTO_4', 4, 'A2_INTE_BOSTO_4', 'A2 INTENSIVE - BOSTON - 06.04.2026 - R4', 'A2', 'BOSTON', 'INTENSIVE',
    '2026-04-06', '2026-05-01', 40, '{"days": ["M", "T", "Th", "F"], "time_range": "15:30-18:00"}', 640.0, 'MixTree Languages - Eerste Weteringplantsoen 2c - 1017 SJ Amsterdam', 0,
    'English File Pre-Intermediate 4th Edition (ISBN-13 978-0194037419)', NOW(), NOW()
);
INSERT INTO course_offerings (
    attendance_id, round, course_key, course_full_name, level, program, type,
    start_date, end_date, hours_total, schedule, price, location, online,
    course_book, created_at, updated_at
) VALUES (
    'B1_INTE_BOSTO_4', 4, 'B1_INTE_BOSTO_4', 'B1 INTENSIVE - BOSTON - 06.04.2026 - R4', 'B1', 'BOSTON', 'INTENSIVE',
    '2026-04-06', '2026-05-01', 40, '{"days": ["M", "T", "Th", "F"], "time_range": "12:30-15:00"}', 640.0, 'MixTree Languages - Eerste Weteringplantsoen 2c - 1017 SJ Amsterdam', 0,
    'English File Intermediate 4th Edition (ISBN-13978-0194035910)', NOW(), NOW()
);
INSERT INTO course_offerings (
    attendance_id, round, course_key, course_full_name, level, program, type,
    start_date, end_date, hours_total, schedule, price, location, online,
    course_book, created_at, updated_at
) VALUES (
    'B2_INTE_BOSTO_4', 4, 'B2_INTE_BOSTO_4', 'B2 INTENSIVE - BOSTON - 06.04.2026 - R4', 'B2', 'BOSTON', 'INTENSIVE',
    '2026-04-06', '2026-05-01', 40, '{"days": ["M", "T", "Th", "F"], "time_range": "12:30-15:00"}', 640.0, 'MixTree Languages - Eerste Weteringplantsoen 2c - 1017 SJ Amsterdam', 0,
    'English File Upper Intermediate 4th Edition (ISBN-978-0194039697)', NOW(), NOW()
);
INSERT INTO course_offerings (
    attendance_id, round, course_key, course_full_name, level, program, type,
    start_date, end_date, hours_total, schedule, price, location, online,
    course_book, created_at, updated_at
) VALUES (
    'B2_MORN_FIFE_3', 3, 'B2_MORN_FIFE_3', 'B2 MORNING - FIFE - 06.04.2026 - R3', 'B2', 'FIFE', 'MORNING',
    '2026-04-06', '2026-05-14', 30, '{"days": ["M", "Th"], "time_range": "9:30-12:00"}', 525.0, 'MixTree Languages - Eerste Weteringplantsoen 2c - 1017 SJ Amsterdam', 0,
    'English File Upper Intermediate 4th Edition (ISBN-978-0194039697)', NOW(), NOW()
);
INSERT INTO course_offerings (
    attendance_id, round, course_key, course_full_name, level, program, type,
    start_date, end_date, hours_total, schedule, price, location, online,
    course_book, created_at, updated_at
) VALUES (
    'A1_BEGI_EDMON_3', 3, 'A1_BEGI_EDMON_3', 'A1 BEGINNER - EDMONTON - 06.04.2026 - R3', 'A1', 'EDMONTON', 'BEGINNER',
    '2026-04-06', '2026-05-13', 24, '{"days": ["M", "W"], "time_range": "15:30-17:30"}', 445.0, 'MixTree Languages - Eerste Weteringplantsoen 2c - 1017 SJ Amsterdam', 0,
    'English File Beginner 4th Edition (ISBN-13 978-0194031608)', NOW(), NOW()
);
INSERT INTO course_offerings (
    attendance_id, round, course_key, course_full_name, level, program, type,
    start_date, end_date, hours_total, schedule, price, location, online,
    course_book, created_at, updated_at
) VALUES (
    'A2 EL_MORN_FIFE_3', 3, 'A2 EL_MORN_FIFE_3', 'A2 ELEM MORNING - FIFE - 06.04.2026 - R3', 'A2 ELEM', 'FIFE', 'MORNING',
    '2026-04-06', '2026-05-13', 30, '{"days": ["M", "W"], "time_range": "9:30-12:00"}', 525.0, 'MixTree Languages - Eerste Weteringplantsoen 2c - 1017 SJ Amsterdam', 0,
    'English File Elementary Plus 4th Edition (ISBN-13 978-0194032414)', NOW(), NOW()
);
INSERT INTO course_offerings (
    attendance_id, round, course_key, course_full_name, level, program, type,
    start_date, end_date, hours_total, schedule, price, location, online,
    course_book, created_at, updated_at
) VALUES (
    'B1_EVE _FIFE_3', 3, 'B1_EVE _FIFE_3', 'B1 EVE ONLINE - FIFE - 06.04.2026 - R3', 'B1', 'FIFE', 'EVE ONLINE',
    '2026-04-06', '2026-05-13', 24, '{"days": ["M", "W"], "time_range": "19:00-21:00"}', 385.0, 'ONLINE', 1,
    'English File Intermediate 4th Edition (ISBN-13978-0194035910)', NOW(), NOW()
);
INSERT INTO course_offerings (
    attendance_id, round, course_key, course_full_name, level, program, type,
    start_date, end_date, hours_total, schedule, price, location, online,
    course_book, created_at, updated_at
) VALUES (
    'B2_EVE _FIFE_3', 3, 'B2_EVE _FIFE_3', 'B2 EVE ONLINE - FIFE - 06.04.2026 - R3', 'B2', 'FIFE', 'EVE ONLINE',
    '2026-04-06', '2026-05-13', 24, '{"days": ["M", "W"], "time_range": "19:00-21:00"}', 385.0, 'ONLINE', 1,
    'English File Upper Intermediate 4th Edition (ISBN-978-0194039697)', NOW(), NOW()
);
INSERT INTO course_offerings (
    attendance_id, round, course_key, course_full_name, level, program, type,
    start_date, end_date, hours_total, schedule, price, location, online,
    course_book, created_at, updated_at
) VALUES (
    'BUSIN_EVE _FIFE_3', 3, 'BUSIN_EVE _FIFE_3', 'BUSINESS EVE ONLINE - FIFE - 06.04.2026 - R3', 'BUSINESS', 'FIFE', 'EVE ONLINE',
    '2026-04-06', '2026-05-13', 24, '{"days": ["M", "W"], "time_range": "19:00-21:00"}', 385.0, 'ONLINE', 1,
    'Business Result Pre-Intermediate 2nd Edition (ISBN-13 978-0194739542)', NOW(), NOW()
);
INSERT INTO course_offerings (
    attendance_id, round, course_key, course_full_name, level, program, type,
    start_date, end_date, hours_total, schedule, price, location, online,
    course_book, created_at, updated_at
) VALUES (
    'C1_MORN_FIFE_3', 3, 'C1_MORN_FIFE_3', 'C1 MORNING - FIFE - 07.04.2026 - R3', 'C1', 'FIFE', 'MORNING',
    '2026-04-07', '2026-05-15', 30, '{"days": ["T", "F"], "time_range": "9:30-12:00"}', 525.0, 'MixTree Languages - Eerste Weteringplantsoen 2c - 1017 SJ Amsterdam', 0,
    'English File Advanced 4th Edition (ISBN-13 978-0194031691)', NOW(), NOW()
);
INSERT INTO course_offerings (
    attendance_id, round, course_key, course_full_name, level, program, type,
    start_date, end_date, hours_total, schedule, price, location, online,
    course_book, created_at, updated_at
) VALUES (
    'A2 PR_EVE _FIFE_3', 3, 'A2 PR_EVE _FIFE_3', 'A2 PRE-INT EVE ONLINE - FIFE - 07.04.2026 - R3', 'A2 PRE-INT', 'FIFE', 'EVE ONLINE',
    '2026-04-07', '2026-05-14', 24, '{"days": ["T", "Th"], "time_range": "19:00-21:00"}', 385.0, 'ONLINE', 1,
    'English File Pre-Intermediate 4th Edition (ISBN-13 978-0194037419)', NOW(), NOW()
);
INSERT INTO course_offerings (
    attendance_id, round, course_key, course_full_name, level, program, type,
    start_date, end_date, hours_total, schedule, price, location, online,
    course_book, created_at, updated_at
) VALUES (
    'A2 PR_MORN_FIFE_3', 3, 'A2 PR_MORN_FIFE_3', 'A2 PRE-INT MORNING - FIFE - 07.04.2026 - R3', 'A2 PRE-INT', 'FIFE', 'MORNING',
